user;title;text;rating;url
Roam762195;Without nighttime structure;"We were in Maresias in May (off-season), rough sea, but very beautiful! Light, soft, and clean sand. We felt safe; however, unfortunately, the city does not offer nightlife structure. Either you consume in the most 'famous' and consequently expensive places, or there are few alternative options for food. The streets are in a precarious situation, without lighting and potholed. Especially on the first days of the week (Monday, Tuesday, and Wednesday), we found most establishments closed, leaving us to have dinner at a bakery.";3;https://www.tripadvisor.com/ShowUserReviews-g1219730-d2429101-r949946866-Maresias_Beach-Maresias_Sao_Sebastiao_State_of_Sao_Paulo.html
951sissib;Maresias Beach;Good extension beach, with a reasonable and quite uneven sand strip. I traveled in April 2024, and the sea was very rough, with several danger signs in various points. Good water temperature.;4;https://www.tripadvisor.com/ShowUserReviews-g1219730-d2429101-r948835783-Maresias_Beach-Maresias_Sao_Sebastiao_State_of_Sao_Paulo.html
brunamF1538OM;Very good;Very beautiful, good beach to enjoy the sea, stay relaxed without people looking you up and down, you can bring your cooler and have fun. We loved it!;4;https://www.tripadvisor.com/ShowUserReviews-g1219730-d2429101-r948422957-Maresias_Beach-Maresias_Sao_Sebastiao_State_of_Sao_Paulo.html
karlacseabra;First visit to Maresias;The beach has a long extension of light sand, and its grains are not so fine. The water was clear and not cold. When the sea is calm, it's possible to enter with children and elderly without problems. When it's not, the lifeguards are on duty and guide the swimmers. Many surfers can be seen along its extension. The presence of human dirt on the sand was noted, and with that, we observed dogs and numerous pigeons. This could be solved by the kiosks themselves, passing a rake daily and collecting straws, toothpicks, salt packets, among others, as, even though they provide trash cans for these, some still end up flying. There is a presence of street vendors and can collectors. On Friday morning, someone appeared every 5 minutes. On other days during the week, there were also some, but much fewer. The security impressed us, a calm place.;3;https://www.tripadvisor.com/ShowUserReviews-g1219730-d2429101-r945617080-Maresias_Beach-Maresias_Sao_Sebastiao_State_of_Sao_Paulo.html
Fearless748132;Maresias paradise!;Loved Maresias, beautiful and attentive people. Stayed in 2 hotels and enjoyed the beach of Maresias and the Maresias Tour. Thank you, Maresias.;5;https://www.tripadvisor.com/ShowUserReviews-g1219730-d2429101-r945391807-Maresias_Beach-Maresias_Sao_Sebastiao_State_of_Sao_Paulo.html
I7003DMcarolinam;Beach;Love São Sebastião Maresias, but the last visit was a bit dirty and abandoned in the area near the central small church.;5;https://www.tripadvisor.com/ShowUserReviews-g1219730-d2429101-r939074895-Maresias_Beach-Maresias_Sao_Sebastiao_State_of_Sao_Paulo.html
Odyssey47147221299;Great beach! Very beautiful!;"White sand, transparent sea! Very beautiful! Great waves for those who like, without major risks, and with lifeguards all along the shore. With children under 5 years, go in the morning when the tide is low, and it's very good for them to play in the water, in the afternoon the tide rises. Repellent is mandatory as soon as you get out of the car; the welcome comes quickly haha.";5;https://www.tripadvisor.com/ShowUserReviews-g1219730-d2429101-r938030658-Maresias_Beach-Maresias_Sao_Sebastiao_State_of_Sao_Paulo.html
fabioh177;Beautiful beach, rough sea in Jan. 2024;Beautiful beach, but the tide was a bit rough (I think it was due to the excess rain days in January). Not very suitable for children. When we sat in the chairs of a kiosk, they charged a minimum consumption fee of 70 reais per person. We didn't accept, as it is abusive, not to mention illegal.;4;https://www.tripadvisor.com/ShowUserReviews-g1219730-d2429101-r935698053-Maresias_Beach-Maresias_Sao_Sebastiao_State_of_Sao_Paulo.html
l_cias374;Impossible to rest;Beautiful beach, but impossible to rest. Everyone wants to listen to their music at maximum volume. Strong waves, not recommended for children.;1;https://www.tripadvisor.com/ShowUserReviews-g1219730-d2429101-r934697299-Maresias_Beach-Maresias_Sao_Sebastiao_State_of_Sao_Paulo.html
marforna;Discomfort of the sound boxes!;Wonderful beach. One of the most interesting in the northern coast of São Paulo! Pity that the enforcement is not active regarding the abuse of sound systems. Truly a pity! For those who want to relax on the beach, this is definitely not the place!;4;https://www.tripadvisor.com/ShowUserReviews-g1219730-d2429101-r932639868-Maresias_Beach-Maresias_Sao_Sebastiao_State_of_Sao_Paulo.html
raquelinyg;Don't create expectations.;I confess I expected much more from such a popular place. Too disappointing... most beaches are steep, but that's okay, as we already knew... What we didn't find in any comment, and is very important, is that except for the main avenue leading to the beach, the surroundings are horrible... narrow streets, no sidewalks... some even with sewage (a horror), the downtown is ugly and small alternating some nice and some very precarious businesses... of course, beachfront hotels and inns are great, but be careful when choosing places within the neighborhood... in the north coast there are much quieter and beautiful beaches both in terms of nature and service offerings that meet expectations. It's really incomprehensible that it's so talked about and at the same time so precarious.;1;https://www.tripadvisor.com/ShowUserReviews-g1219730-d2429101-r931653214-Maresias_Beach-Maresias_Sao_Sebastiao_State_of_Sao_Paulo.html
Dreamer37305322711;Very bad;No sidewalks on the street. Motorcyclists ride very fast and popping wheelies. Nothing special in place...;1;https://www.tripadvisor.com/ShowUserReviews-g1219730-d2429101-r931006026-Maresias_Beach-Maresias_Sao_Sebastiao_State_of_Sao_Paulo.html
hermanvani;One of the most famous in São Sebastião;Beach with a good structure of stalls, vendors, and restaurants, a bit busy, but within what it can handle, worth spending the day...;4;https://www.tripadvisor.com/ShowUserReviews-g1219730-d2429101-r930761710-Maresias_Beach-Maresias_Sao_Sebastiao_State_of_Sao_Paulo.html
_Sastavo;Very tasty;We went at the beginning of December and midweek, so it was very peaceful, few people, all very clean and quiet. I recommend!;5;https://www.tripadvisor.com/ShowUserReviews-g1219730-d2429101-r930300833-Maresias_Beach-Maresias_Sao_Sebastiao_State_of_Sao_Paulo.html
770m_rciac;Merchants exploitative and rude;The place is beautiful, but totally unprepared to receive tourists. At the beach, to rent a broken umbrella, you have a minimum consumption fee. The rental persons are extremely rude. If you bring your own umbrella, they create problems to serve you. Rude people, no manners, they don't know how to deal with tourists. A place to never look for again. Not even on Google.;1;https://www.tripadvisor.com/ShowUserReviews-g1219730-d2429101-r920707022-Maresias_Beach-Maresias_Sao_Sebastiao_State_of_Sao_Paulo.html
Trotamundo562;Queen Beach;I saw the name of Maresias since I was a child, spent holidays in a vacation camp in Caraguatatuba and saw signs for Maresias, and the people who went there. The arrival of asphalt in 1989 changed things, and the surfing village became synonymous with glamour in the area, with the most valued properties in the region. The years, decades pass, and it remains different.;5;https://www.tripadvisor.com/ShowUserReviews-g1219730-d2429101-r884083557-Maresias_Beach-Maresias_Sao_Sebastiao_State_of_Sao_Paulo.html
edumms;Maresias; Incredible, I'm biased to talk about this beach that ever since I was a child, we stayed at the best hotel in Maresias! My cousin's wedding.;5;https://www.tripadvisor.com/ShowUserReviews-g1219730-d2429101-r882447678-Maresias_Beach-Maresias_Sao_Sebastiao_State_of_Sao_Paulo.html
AntonioNascimento31;Beautiful; Beautiful beach, although very rough sea, not recommended for bathing. It has a great infrastructure.;5;https://www.tripadvisor.com/ShowUserReviews-g1219730-d2429101-r879866593-Maresias_Beach-Maresias_Sao_Sebastiao_State_of_Sao_Paulo.html
Edmar40;Really nice;Beautiful beach. Beautiful sunset. Steep beach. Strong current. Not very suitable for children. Has surfers. Good structure and clean beach.;5;https://www.tripadvisor.com/ShowUserReviews-g1219730-d2429101-r877592788-Maresias_Beach-Maresias_Sao_Sebastiao_State_of_Sao_Paulo.html
alluve;Excellent place to relax;Excellent place to rest… Peaceful beach, beautiful, and beautiful sea with clean waters... especially at the beginning of the week.;5;https://www.tripadvisor.com/ShowUserReviews-g1219730-d2429101-r876904090-Maresias_Beach-Maresias_Sao_Sebastiao_State_of_Sao_Paulo.html
fabianao844;Indescribable sunset;Beach with clear waters and strong waves. Watching a stunning sunset at Maresias Beach, to the sound of the strong waves, was undoubtedly a great privilege.;5;https://www.tripadvisor.com/ShowUserReviews-g1219730-d2429101-r876665827-Maresias_Beach-Maresias_Sao_Sebastiao_State_of_Sao_Paulo.html
gilsons941;Bad;The main street that is at the exit of the beach is filthy, with open cesspools. The sidewalk is small and potholed, including part of the sidewalk being invaded by the local commerce, leaving little space for pedestrians to circulate. The impression given is that the city has abandoned the place.;2;https://www.tripadvisor.com/ShowUserReviews-g1219730-d2429101-r876557260-Maresias_Beach-Maresias_Sao_Sebastiao_State_of_Sao_Paulo.html
alexdupas;Great beach;Beautiful beach, great for swimming and lounging on the sand. Safety! Every 100m there is a lifeguard always guiding the swimmers.;5;https://www.tripadvisor.com/ShowUserReviews-g1219730-d2429101-r875356594-Maresias_Beach-Maresias_Sao_Sebastiao_State_of_Sao_Paulo.html
lucasbaraujoo;Best beach in São Paulo;Without a doubt, it is the best beach in the entire state of São Paulo, an extremely clean beach with water quality not easily found in SP. The problem is that the city hall should invest more in the infrastructure of the city and the Orla street.;5;https://www.tripadvisor.com/ShowUserReviews-g1219730-d2429101-r875296615-Maresias_Beach-Maresias_Sao_Sebastiao_State_of_Sao_Paulo.html
flaviosizenandoj;Loved the beach!!;Clean beach, good stalls, easy access, I liked it a lot. We will return in the near future. That's it...;5;https://www.tripadvisor.com/ShowUserReviews-g1219730-d2429101-r875290439-Maresias_Beach-Maresias_Sao_Sebastiao_State_of_Sao_Paulo.html
ijacomeli;Excellent;Certainly an unforgettable part of our trip. Well-structured place, clean beach, wonderful sea with good waves as well. The city itself also helps with interesting options.;5;https://www.tripadvisor.com/ShowUserReviews-g1219730-d2429101-r873501091-Maresias_Beach-Maresias_Sao_Sebastiao_State_of_Sao_Paulo.html
agnonp;Ok;"Clean beach, excellent structure, but prices are very abusive even being in high season. For example, a gallon of water costs 15 reais; the same gallon in Ubatuba I paid 8 reais 2 days ago, kiosks minimum consumption of 70 reais per person, and so on. I came, I saw, I enjoyed, but I won't return.";3;https://www.tripadvisor.com/ShowUserReviews-g1219730-d2429101-r872639464-Maresias_Beach-Maresias_Sao_Sebastiao_State_of_Sao_Paulo.html
S2045XZcristinap;Clean beach with lifeguards;Very inviting and safe beach, lifeguards all around, very clean, some kiosks with drinks and food, and several seaside restaurants.;5;https://www.tripadvisor.com/ShowUserReviews-g1219730-d2429101-r870794818-Maresias_Beach-Maresias_Sao_Sebastiao_State_of_Sao_Paulo.html
ClaudianaCMC;Recommend;The beach is clean, with white sand and beautiful sea. It's very lively, with kiosks and several shopping options.;4;https://www.tripadvisor.com/ShowUserReviews-g1219730-d2429101-r848935252-Maresias_Beach-Maresias_Sao_Sebastiao_State_of_Sao_Paulo.html
MarcioHaraguchi;Beautiful beach with good structure;"Being honest, the coast of São Paulo is not easy. Before going, check the weather forecast and the tide table. If you like waves, you'll go crazy if they're flat, if you're afraid of waves, the beach can be very agitated and dangerous for the unwary. If it's a holiday, it can be crowded, and all kinds of services in the region overloaded. Not to mention the traffic to go to and from the capital. If you have time, don't go on Friday or come back on Sunday; it's guaranteed to get stuck in traffic. It sounds funny, but it requires more planning than it seems...";4;https://www.tripadvisor.com/ShowUserReviews-g1219730-d2429101-r837355373-Maresias_Beach-Maresias_Sao_Sebastiao_State_of_Sao_Paulo.html
K6524ERgustavop;Clean beach;Very clean beach, you can see fish swimming at your feet on days with low tide, very nice to stay there.;5;https://www.tripadvisor.com/ShowUserReviews-g1219730-d2429101-r837100600-Maresias_Beach-Maresias_Sao_Sebastiao_State_of_Sao_Paulo.html
lucasddomingues;Maresias;Maresias Beach: a very beautiful beach but extremely dangerous due to the waves. Despite the good structure, I found the prices very abusive.;5;https://www.tripadvisor.com/ShowUserReviews-g1219730-d2429101-r834674800-Maresias_Beach-Maresias_Sao_Sebastiao_State_of_Sao_Paulo.html
theWhK;Great beach!;You can't bathe as the slope is steep, but it's very spacious and very good. The infrastructure is also very nice.;5;https://www.tripadvisor.com/ShowUserReviews-g1219730-d2429101-r833442666-Maresias_Beach-Maresias_Sao_Sebastiao_State_of_Sao_Paulo.html
marcelleromagnolli;Disappointing vacation;"I scheduled my vacation in Maresias based on YouTube videos made by people who have been here and internet reviews. I regretted it so much! From what they said, I thought it was a ""Búzios of São Paulo,"" big mistake! As soon as we arrived at the Airbnb, the owner said we should walk to the middle of the beach because in the corner where we stayed, bathers got a lot of viruses due to the Maresias River full of sewage flowing there. Beach with no lighting at night, no infrastructure, sand full of seaweed and pigeons. Very strong sea, and worst of all: it RAINED EVERY DAY we were there! But it was not a common rain... it was torrential, and we were literally locked in because there's no Uber in the neighborhood either! São Paulo coast never again!";1;https://www.tripadvisor.com/ShowUserReviews-g1219730-d2429101-r833164791-Maresias_Beach-Maresias_Sao_Sebastiao_State_of_Sao_Paulo.html
juliocesarperess;Amazing beach;Maresias is a beach hidden by a wall of houses, inns, and hotels, unfortunately, but you can access the beach through some entrances. What pleased me the most was the beach being firm on the bottom avoiding holes. We stayed in the late afternoon, and the sunset is beautiful. I recommend it!!;5;https://www.tripadvisor.com/ShowUserReviews-g1219730-d2429101-r832006775-Maresias_Beach-Maresias_Sao_Sebastiao_State_of_Sao_Paulo.html
bapulin;Maresias never disappoints;This beach never disappoints. The sand and sea are always clean. I feel some security in the area. And there are options of beach stands to eat.;5;https://www.tripadvisor.com/ShowUserReviews-g1219730-d2429101-r831237322-Maresias_Beach-Maresias_Sao_Sebastiao_State_of_Sao_Paulo.html
natsgrott;Beautiful beach;Beautiful and clean beach!! Very strong sea!! Great for surfers! Great restaurants, but with a high price! Worth knowing.;5;https://www.tripadvisor.com/ShowUserReviews-g1219730-d2429101-r831236930-Maresias_Beach-Maresias_Sao_Sebastiao_State_of_Sao_Paulo.html
fabiolD4350ME;The beach is very beautiful with clean water, but...;The beach is very beautiful with clean water, but the absurd amount of pets on the sand surprised me. Despite the municipal law that does not allow it. I saw firefighters passing by and doing nothing, nothing against their feet, however, on the beach...;2;https://www.tripadvisor.com/ShowUserReviews-g1219730-d2429101-r830814596-Maresias_Beach-Maresias_Sao_Sebastiao_State_of_Sao_Paulo.html
Voyager740560;Maresias I love you!;"I have always been and still am a lover of Maresias for many years, this is the fourth time I visited with my family. I live in the Midwest and consider this one of the most beautiful beaches on the São Paulo coast! Unfortunately, I have some negative points to observe: The municipality insists on not placing enough trash cans, I suggest concrete manholes with a diameter of 60 cm (vandal-proof) in the middle of the way (width of the sand strip), as close to the water as possible, to make it easier for people to dispose of their trash, which will also facilitate cleaning and the municipality's collection after; They should prohibit the use of loud sound, it takes away the relaxing and pleasant environment of just listening to the sea noise and nature, when very crowded it becomes a real Bahian carnival; People from the stalls often consider themselves owners of the sand strip, not allowing tourists who do not consume drinks and others to stay in ""their space,"" I suffered this intimidation in 2020, very unpleasant. There is also a need for removable public toilets, as e...";3;https://www.tripadvisor.com/ShowUserReviews-g1219730-d2429101-r830254114-Maresias_Beach-Maresias_Sao_Sebastiao_State_of_Sao_Paulo.html
felipefP2883CO;Excellent!;Very beautiful beach, with fine sand and good vibe! The water temperature was great, very warm. I recommend staying in the central part of the beach, from point 8 upwards, as the left corner (for those facing the sea) tends to get very crowded.;5;https://www.tripadvisor.com/ShowUserReviews-g1219730-d2429101-r829976143-Maresias_Beach-Maresias_Sao_Sebastiao_State_of_Sao_Paulo.html
LucioClerc;Beautiful beach, streets and sidewalks neglected.;The problem in the entire region is the lack of care from the municipality with public walkways. The sidewalks practically do not exist, when there is any pavement, it is broken or too narrow. It is impossible to get around without watching where you step. Those with mobility issues have no way to move. I did not witness or have problems with safety on the streets, even during quieter times.;5;https://www.tripadvisor.com/ShowUserReviews-g1219730-d2429101-r829375730-Maresias_Beach-Maresias_Sao_Sebastiao_State_of_Sao_Paulo.html
mariSolange;Good for surfing!;"Maresias Beach is located in the city of São Sebastião. The trendy beach is a haunt for surfers as it has a sea suitable for ""catching a wave."" Beautiful, surrounded by vegetation, it offers excellent infrastructure, but those looking for tranquility should seek another beach.";4;https://www.tripadvisor.com/ShowUserReviews-g1219730-d2429101-r826343200-Maresias_Beach-Maresias_Sao_Sebastiao_State_of_Sao_Paulo.html
marcosviniciom;"""Burnt Out"" Week";Very peaceful beach, exudes a lot of security and familiarity, easy access, great gastronomic structure.;5;https://www.tripadvisor.com/ShowUserReviews-g1219730-d2429101-r826155619-Maresias_Beach-Maresias_Sao_Sebastiao_State_of_Sao_Paulo.html
U6212ZDmarcosm;Quiet beach;Beach with weak waves until noon, after the tide rises, it becomes a surfing beach, it has great stalls with merchandise at affordable prices and with polite and courteous staff.;4;https://www.tripadvisor.com/ShowUserReviews-g1219730-d2429101-r825794844-Maresias_Beach-Maresias_Sao_Sebastiao_State_of_Sao_Paulo.html
MarciaMontanha04;Beach;Wonderful beach, beautiful sunset, but the sea is not for children, the sea is very dangerous despite having lifeguards.;5;https://www.tripadvisor.com/ShowUserReviews-g1219730-d2429101-r825266424-Maresias_Beach-Maresias_Sao_Sebastiao_State_of_Sao_Paulo.html
fabiolai711;Delicious beach;Super clean beach! Well supplied with lifeguards and other services. Peaceful in terms of visitors. Great for walking.;5;https://www.tripadvisor.com/ShowUserReviews-g1219730-d2429101-r824553035-Maresias_Beach-Maresias_Sao_Sebastiao_State_of_Sao_Paulo.html
U3200MBfelipem;On the brink of decadence;"I have been a beachgoer for a long time. I have been to Maresias a few times over 25 years. The beach is clean, but it is heading towards the same fate as other destinations. Privatized sand space, ""shoe"" visitors, people wearing makeup, crowds, abusive prices with no quality at all, people parading by car (many clearly with their parents' cars).. More like Guarujá than São Sebastião. It was nice because I love the beach, but I don't plan on returning anymore... If you like to enjoy the beach, I recommend the tip near the river... but I think it's better to go to another destination if you seek a peaceful beachgoer.…";3;https://www.tripadvisor.com/ShowUserReviews-g1219730-d2429101-r824482838-Maresias_Beach-Maresias_Sao_Sebastiao_State_of_Sao_Paulo.html
leandroc886;Very Good Beach;Very good water quality, beach was crowded, the only downside is the high price they charge for chair rentals, having to end up consuming at the kiosk to avoid it becoming even more expensive.;3;https://www.tripadvisor.com/ShowUserReviews-g1219730-d2429101-r824142532-Maresias_Beach-Maresias_Sao_Sebastiao_State_of_Sao_Paulo.html
maurol16;High energy, a feast for the eyes!;We spent the end of the year in Caraguatatuba, and one of the options was to visit Maresias Beach in São Sebastião. A distance of a little over 30 km between the 2 cities, with a travel time of around 1 hour, but it was worth it. The beach is very beautiful, excellent structure, with high energy. An excellent trip that was worth it, next time we will choose to stay longer. In addition to the good structure of the kiosks, there are excellent restaurant options. Very good!;5;https://www.tripadvisor.com/ShowUserReviews-g1219730-d2429101-r823928264-Maresias_Beach-Maresias_Sao_Sebastiao_State_of_Sao_Paulo.html
valdiviacps;Did not meet my expectations;Steep beach, no chance for those going with children or the elderly. Mostly frequented by the younger crowd. Strong smell of marijuana everywhere. The neighborhood has a precarious structure. I observed a lot of trash on the streets. In my opinion, there are better beaches in São Sebastião.;2;https://www.tripadvisor.com/ShowUserReviews-g1219730-d2429101-r823836884-Maresias_Beach-Maresias_Sao_Sebastiao_State_of_Sao_Paulo.html
Thaysfaa;Big waves, crowded and expensive;This is not a beach for people looking for a clam place. The water is very rough, great for surfers, I did not feel very safe in the main street, nothing special about this place, this is a famous beach, things here are very expensive, but as I don't surf, this is not the place for me.;3;https://www.tripadvisor.com/ShowUserReviews-g1219730-d2429101-r780803811-Maresias_Beach-Maresias_Sao_Sebastiao_State_of_Sao_Paulo.html
rhonie2018;Peace at last!;The beach is clean and quiet. No boom boxes and only a few restaurants with beach service at the far end in town. The modern houses and small hotel have some foliage so you are not as aware that their are low buildings that border the beach. Of the beaches that I have visited during my 20 years of Brazil travel, without driving extra hours from my destination, I enjoy it here with the rolling green mountain vistas and clean soft sand.;4;https://www.tripadvisor.com/ShowUserReviews-g1219730-d2429101-r708933802-Maresias_Beach-Maresias_Sao_Sebastiao_State_of_Sao_Paulo.html
Georg1967;Super Waves;very nice an clean beach. high and breathtaking waves. You can rent a surf board at the beach. Lovely bars to have small food or some beers.;5;https://www.tripadvisor.com/ShowUserReviews-g1219730-d2429101-r668264306-Maresias_Beach-Maresias_Sao_Sebastiao_State_of_Sao_Paulo.html
922ekaterinab;One of the most beautiful beaches;Amazingly beautiful beach with big waves. Not possible to swim with really small kids but enjoy the surfers and incredible ocean. One of my favorites places in the world.;5;https://www.tripadvisor.com/ShowUserReviews-g1219730-d2429101-r659736183-Maresias_Beach-Maresias_Sao_Sebastiao_State_of_Sao_Paulo.html
EmiliaH399;Loved the beach!;Really nice beach, soft sand and smaller waves. Restaurants and shops near by. Good place to spend the day!;5;https://www.tripadvisor.com/ShowUserReviews-g1219730-d2429101-r640503872-Maresias_Beach-Maresias_Sao_Sebastiao_State_of_Sao_Paulo.html
Robby500;Busy - great food - amaizing waves;Probably the busiest beach I have ever been to!  The waves are super strong, and huge, make sure not to go too deep in the water, as you will be without support in a second.  If you stay in the low waters, you will have a great time though.  I appreciated the service on the beach, including a lot of (bar-)food options.;5;https://www.tripadvisor.com/ShowUserReviews-g1219730-d2429101-r631615833-Maresias_Beach-Maresias_Sao_Sebastiao_State_of_Sao_Paulo.html
rudolfrosasf;nice place;Nice beach well served with all you could need as drinks and food. Although some parts of the beach were labelled dangerous for swimming.;4;https://www.tripadvisor.com/ShowUserReviews-g1219730-d2429101-r596230191-Maresias_Beach-Maresias_Sao_Sebastiao_State_of_Sao_Paulo.html
h_konu849;Nice beach;A very nice beach, in a less populated village. When we arrived there were not so many people here either. But when Easter started, it became a lot more people;5;https://www.tripadvisor.com/ShowUserReviews-g1219730-d2429101-r588800437-Maresias_Beach-Maresias_Sao_Sebastiao_State_of_Sao_Paulo.html
962fadias;simply the best;this beach is great, not so crowded, beautiful beach to walk in peace and enjoy the wonderful scenery, loved it!;5;https://www.tripadvisor.com/ShowUserReviews-g1219730-d2429101-r575625296-Maresias_Beach-Maresias_Sao_Sebastiao_State_of_Sao_Paulo.html
