user,title,text,rating,url
AustTrail,Lovely spot for a walk,"Mereweather Beach A lovely beach to visit in Newcastle. It was very choppy the day we visited but it was still spectacular to see the surfers do their thing and see the powerful waves crash to shore.
The bluff near the baths have interesting rocks to look at if you are interested in geology. Observed a few fossils and the rock pool great for kids.",4,https://www.tripadvisor.com/ShowUserReviews-g255325-d3246009-r948340715-Merewether_Beach-Newcastle_Greater_Newcastle_New_South_Wales.html
yazitravels,Lovely beach,Mereweather Beach A couple of parking spaces in the parking and along the street. Clean beach with a cafe at the edge and also lifeguards and surfers. Perfect to just sit and watch or to wet your feet.,3,https://www.tripadvisor.com/ShowUserReviews-g255325-d3246009-r884241707-Merewether_Beach-Newcastle_Greater_Newcastle_New_South_Wales.html
lkamphuis,Worth a visit,Mereweather Beach What a stunning location - we loved the look out with the faux grass perfect for picnics - parking is more challenging but definitely worth  a visit,5,https://www.tripadvisor.com/ShowUserReviews-g255325-d3246009-r868080157-Merewether_Beach-Newcastle_Greater_Newcastle_New_South_Wales.html
ThomasE504,Not worth it,"Mereweather Beach I lived here in 2022. This beach was really horrible. Superficial people, a beach destroyed by a disgusting beach club and a pub across the road full of superficial tossers.",1,https://www.tripadvisor.com/ShowUserReviews-g255325-d3246009-r831519624-Merewether_Beach-Newcastle_Greater_Newcastle_New_South_Wales.html
RetireeBob,Heavy Shore Breaking Waves made it Difficult to Enjoy the Surf,"Mereweather Beach We visited this beach every day for a week. The shore break made it dangerous for anyone who was not good swimmer. Relief came from splashing in the wash. The facilities at the beach precinct are vey good, so a reasonably pleasant hour or two could be had here, but not so much in the water.",3,https://www.tripadvisor.com/ShowUserReviews-g255325-d3246009-r823993340-Merewether_Beach-Newcastle_Greater_Newcastle_New_South_Wales.html
Oscarsmith7,Oar sum,Mereweather Beach Excellent place for a walk and a swim. Was surprised there was so much parking available. Scenic and serene. One of the best parts of Newy,4,https://www.tripadvisor.com/ShowUserReviews-g255325-d3246009-r813272322-Merewether_Beach-Newcastle_Greater_Newcastle_New_South_Wales.html
182victorp,Such a beautiful spot,Mereweather Beach Bought lunch from Swell Kiosks and spent a few hours Merewether Beach watching our daughter playing with sand building. Such a beautiful spot.,5,https://www.tripadvisor.com/ShowUserReviews-g255325-d3246009-r805917668-Merewether_Beach-Newcastle_Greater_Newcastle_New_South_Wales.html
tashakxox,Best beach,"Mereweather Beach I love this beach as do my family, beautiful clean beach and friendly locals. Def a must visit attraction and the bathes,",5,https://www.tripadvisor.com/ShowUserReviews-g255325-d3246009-r796075521-Merewether_Beach-Newcastle_Greater_Newcastle_New_South_Wales.html
N3401AOaarons,Parking is a nightmare!,Mereweather Beach Don’t expect to come down here on a sunny weekend day and expect to park. Took us almost an hour to find a space. And that was just down to luck as we saw someone leaving. But the beach....wow.....it’s incredible.,4,https://www.tripadvisor.com/ShowUserReviews-g255325-d3246009-r788202215-Merewether_Beach-Newcastle_Greater_Newcastle_New_South_Wales.html
den003,Great beach section,"Mereweather Beach Very busy beach area. The facilities were very busy as it was a nice day, but lots of toilets and showers. Still room on the beach. Stunning coastal walk along from Nobbys head",4,https://www.tripadvisor.com/ShowUserReviews-g255325-d3246009-r786884523-Merewether_Beach-Newcastle_Greater_Newcastle_New_South_Wales.html
leeannes2015,Beautiful Beach,"Mereweather Beach Visited Merewether Beach recently for the first time & it was lovely.  It is patrolled by life guards.  Parking isn't that great, there is no car park so need to find street parking.  The surf club is amazing with a restaurant and a cafe down on beach level.  Easy to stay for the whole day.",5,https://www.tripadvisor.com/ShowUserReviews-g255325-d3246009-r781441956-Merewether_Beach-Newcastle_Greater_Newcastle_New_South_Wales.html
camsean,Summer Australian Style,"Mereweather Beach Merewether beach is a great example of a typical Australian beach. The water is clean and bracing and it is never really that crowded.

There is also a large ocean pool.",4,https://www.tripadvisor.com/ShowUserReviews-g255325-d3246009-r781116201-Merewether_Beach-Newcastle_Greater_Newcastle_New_South_Wales.html
Oscarsmith7,Excellent,"Mereweather Beach Easy to get a park, and the ocean baths were fantastic. Great for walking, swimming or dining. Scenic place",5,https://www.tripadvisor.com/ShowUserReviews-g255325-d3246009-r780070792-Merewether_Beach-Newcastle_Greater_Newcastle_New_South_Wales.html
ChristineT851,Stunning views and great food,"Mereweather Beach Lovely lunch at Merewether Surf House today, prawn pizza and a cocktail in the sunshine. Nothing better!",5,https://www.tripadvisor.com/ShowUserReviews-g255325-d3246009-r776010869-Merewether_Beach-Newcastle_Greater_Newcastle_New_South_Wales.html
TerryAussie_1,Walk the promenade and enjoy the view,"Mereweather Beach There are actually 3 beaches here with one long promenade, Merewether, Bar & Dixon Park beach. Views of the headland are spectacular as you want the promenade. Plenty of places to stop for coffee or brunch as you watch the surfers.",5,https://www.tripadvisor.com/ShowUserReviews-g255325-d3246009-r776003580-Merewether_Beach-Newcastle_Greater_Newcastle_New_South_Wales.html
daveandbrydie,One of the beat beaches in Australia!,"Mereweather Beach From the beach to the wonderful ocean baths, Merewether Beach is amazing all times of the year. We’ve smashed out fitness goals in winter with that long set of stairs and cold water swims, to cooling off in Summer with a splash in the waves. Great to watch the coal ships go past and we always seem to see at least 2 aircraft. A busy and friendly place that we’d recommended visiting if you’re looking for a beach along the Newcastle coastline.",5,https://www.tripadvisor.com/ShowUserReviews-g255325-d3246009-r775702812-Merewether_Beach-Newcastle_Greater_Newcastle_New_South_Wales.html
MosesPH,Such a Beautiful Beach and Ocean View,"Mereweather Beach A visit to Merewether Beach is must if you are visiting Newcastle - around 2kms away from the CBD it is a lovely beach. Long stretch of beach and an amazing ocean bath and pools. Paved so you can walk on a path or better if you want to walk along the sand or along the water. Great place for families and the ocean baths have lots of spaces suitable for toddlers, little kids, youth and adult. Such a nice atmosphere and lovely cafe with good food selection and coffee. Can sit and enjoy the views all day here.",5,https://www.tripadvisor.com/ShowUserReviews-g255325-d3246009-r773388510-Merewether_Beach-Newcastle_Greater_Newcastle_New_South_Wales.html
BarryH1966,One of the best views on the East Coast,"Mereweather Beach This has to be one of the best beaches on the east coast, great views, great surf and great coffee from the Blue Door Kiosk, Coffee with a View!",5,https://www.tripadvisor.com/ShowUserReviews-g255325-d3246009-r771651357-Merewether_Beach-Newcastle_Greater_Newcastle_New_South_Wales.html
RayWatson,Nice beach for a visit,"Mereweather Beach Enjoyed viewing the Baths and the beach was lovely, very crowded so very popular.  We had a lovely day in Newcastle and this beach added to our joy.  Enjoy",5,https://www.tripadvisor.com/ShowUserReviews-g255325-d3246009-r756560468-Merewether_Beach-Newcastle_Greater_Newcastle_New_South_Wales.html
MMW55,Beautiful views,Mereweather Beach From Dixon Park to the other side of Merewether beach is  an easy walk with great views and two popular places to buy food and drinks.  Watching the morning sunrise on the waves is breathtaking.,5,https://www.tripadvisor.com/ShowUserReviews-g255325-d3246009-r751633887-Merewether_Beach-Newcastle_Greater_Newcastle_New_South_Wales.html
sandramG5252VG,"Beautiful, clean sandy beach","Mereweather Beach Merewether Beach is awesome.  Well patrolled, clean and great for families as well as surfers.  It's home to some international surfing stars and locals love it too.",5,https://www.tripadvisor.com/ShowUserReviews-g255325-d3246009-r749314394-Merewether_Beach-Newcastle_Greater_Newcastle_New_South_Wales.html
Trickus1965,Wonderful 24hour 7 day swim,Mereweather Beach Merewether Beach wonderful. The baths more wonderful. Access 24 hours a day. Every day during hot days.,4,https://www.tripadvisor.com/ShowUserReviews-g255325-d3246009-r747011862-Merewether_Beach-Newcastle_Greater_Newcastle_New_South_Wales.html
439nevilles,Lovely,"Mereweather Beach This is the best surf beach in Newcastle in my opinion,  free parking, restaurants and change rooms and great surf,  also great for dog walking",5,https://www.tripadvisor.com/ShowUserReviews-g255325-d3246009-r744908341-Merewether_Beach-Newcastle_Greater_Newcastle_New_South_Wales.html
DANIZ1234,Group visit,Mereweather Beach Combo of Merewether beach and bar beach are very nice. There’s some rock pools at the northern end. A cafe kiosk on the bar beach end and the mere weather surf house at southern end. Lots of parking (but does fill up) and a skate park across the road in the middle. Lots of families and it’s patrolled.,5,https://www.tripadvisor.com/ShowUserReviews-g255325-d3246009-r744434595-Merewether_Beach-Newcastle_Greater_Newcastle_New_South_Wales.html
AussieKate13,A great place for a swim,"Mereweather Beach The Merewether Ocean Baths are a great place to swim.  Yep I am here again. They have an area for laps and a ramp for disability access. Ocean water fills the baths. They are pumped out and cleaned regularly. There is parking, public transport, a nice walking path, places to eat. A good place to visit.",5,https://www.tripadvisor.com/ShowUserReviews-g255325-d3246009-r742168922-Merewether_Beach-Newcastle_Greater_Newcastle_New_South_Wales.html
870aidenm,Scenic & good for kids,Mereweather Beach Nice sand. There’s a pool spot for kids. Facilities available. Short walk into town for food.pretty beach.,4,https://www.tripadvisor.com/ShowUserReviews-g255325-d3246009-r741652148-Merewether_Beach-Newcastle_Greater_Newcastle_New_South_Wales.html
DEP3,gorgeous views at a popular summer beach for swimming,"Mereweather Beach Part of a cruise ship shore excursion, this beach is popular with the locals,too. Dramatic backdrops for photo taking. Lovely  for strolling. expect high temperatures in December. Has places to eat, too.",5,https://www.tripadvisor.com/ShowUserReviews-g255325-d3246009-r737155791-Merewether_Beach-Newcastle_Greater_Newcastle_New_South_Wales.html
Mon55,"Popular beach, great seaside walk too",Mereweather Beach Beautiful patrolled beach with lots of nearby parking. great place to take the family for a fun time. Lots of cafes nearby too.,4,https://www.tripadvisor.com/ShowUserReviews-g255325-d3246009-r736380443-Merewether_Beach-Newcastle_Greater_Newcastle_New_South_Wales.html
LVSNeco,A must do beach,"Mereweather Beach I will keep it simple.. Merewether beach is a MUST DO if you are in Newcastle 

Clean, patrolled, lots to do and see and good food. Go here and make good memories.",5,https://www.tripadvisor.com/ShowUserReviews-g255325-d3246009-r736212334-Merewether_Beach-Newcastle_Greater_Newcastle_New_South_Wales.html
jalamacoza,The Bondi of Newcastle,"Mereweather Beach Awesome beach, great boardwalk that goes for miles. Much hype and activity, uphill walk, skating, cycling, dogs, kids, couples - parks and playgrounds.",5,https://www.tripadvisor.com/ShowUserReviews-g255325-d3246009-r729489734-Merewether_Beach-Newcastle_Greater_Newcastle_New_South_Wales.html
newcastle2300,Great place for a swim on a hot day,"Mereweather Beach Easy parking nearby, clean beach for swimming, good coffee nearby, a bit of whale watching and general people watching.",5,https://www.tripadvisor.com/ShowUserReviews-g255325-d3246009-r724812849-Merewether_Beach-Newcastle_Greater_Newcastle_New_South_Wales.html
322Linda,Stunning beach and rock pools.,Mereweather Beach Had a beautiful evening swim in the rock pools after a long walk on the beach. Some very nice shells on the beach.,5,https://www.tripadvisor.com/ShowUserReviews-g255325-d3246009-r724366374-Merewether_Beach-Newcastle_Greater_Newcastle_New_South_Wales.html
gregd538,Great Beach,"Mereweather Beach Very popular beach in Newcastle. The beach stretches from Merewether to Bar Beach with Dixon Park Beach in between. Great for walking or running along the beach.  Great location. Close to Merewether Ocean Baths, Cafes and a very popular pub across the road. What more could you ask for.",5,https://www.tripadvisor.com/ShowUserReviews-g255325-d3246009-r724258366-Merewether_Beach-Newcastle_Greater_Newcastle_New_South_Wales.html
Madshus,Nice promenade,"Mereweather Beach I didn't go into the water as I'd got to Newcastle too late; but my host and I walked up and down the beach, and along the promenade. It's a nice beach for sure at dusk. Not far from the centre of town and its cafes and restaurants.",4,https://www.tripadvisor.com/ShowUserReviews-g255325-d3246009-r722706317-Merewether_Beach-Newcastle_Greater_Newcastle_New_South_Wales.html
phillipk8,Simply stunning !,Mereweather Beach What more could you ask for than sitting on merewether beach having a fantastic lunch watching the board riders doing their thing in the waves A great safe beach and a amazing beach to walk along .Showers and toilet facilities are available .,5,https://www.tripadvisor.com/ShowUserReviews-g255325-d3246009-r719884070-Merewether_Beach-Newcastle_Greater_Newcastle_New_South_Wales.html
Aussie8888,"Beautiful beach, cafes, parking, surfing - awesome","Mereweather Beach On a wonderful stretch of beaches from merewether up to Bar Beach, there is clear / clean water and plenty of parking. Two cafes and a restaurant right on the beach, with good facilities. Known for some good surfing and never crowded (unlike Sydney beaches).",5,https://www.tripadvisor.com/ShowUserReviews-g255325-d3246009-r716456639-Merewether_Beach-Newcastle_Greater_Newcastle_New_South_Wales.html
BabyandUs,Lovely !,"Mereweather Beach Beautiful beach, lots of surf lifesaving, great coastal walks and if you add in the Memorial Walk too, you could walk for ages. Baths looked good but we didn't go in.",5,https://www.tripadvisor.com/ShowUserReviews-g255325-d3246009-r714663564-Merewether_Beach-Newcastle_Greater_Newcastle_New_South_Wales.html
Chopper1959,Newcastle Drive 2019,"Mereweather Beach We drove along the coastal drive to Mereweather beach, great views of the ocean and rock formations, parking available, the ocean baths were not in use as the council was removing sand and cleaning them.",5,https://www.tripadvisor.com/ShowUserReviews-g255325-d3246009-r714349787-Merewether_Beach-Newcastle_Greater_Newcastle_New_South_Wales.html
healthygirl222,Stunning beach,Mereweather Beach Great food at the Surf club with wonderful views. The enclosed ocean baths are safe and great to swim in.,5,https://www.tripadvisor.com/ShowUserReviews-g255325-d3246009-r707927791-Merewether_Beach-Newcastle_Greater_Newcastle_New_South_Wales.html
karendT7089NE,Fantasic beach,Mereweather Beach Spectacular Beach! Perfect waves. Always clean and tidy shore with friendly people enjoying hassle free lifestyle.,5,https://www.tripadvisor.com/ShowUserReviews-g255325-d3246009-r706136518-Merewether_Beach-Newcastle_Greater_Newcastle_New_South_Wales.html
phalseprofit,Quick drive to beach,Mereweather Beach I drove down on Sunday.  The sun was out. There was surf about 3 to 5 foot. Was quite large. Nice breeze and lots of parks in the car park..Good place one of the best beaches in Australia,4,https://www.tripadvisor.com/ShowUserReviews-g255325-d3246009-r696785876-Merewether_Beach-Newcastle_Greater_Newcastle_New_South_Wales.html
779kerrieb,Showing off Newcastle to international visitors,Mereweather Beach Newcastle has the most beautiful beaches in a relaxed country town environment it’s a must see destination for all travellers,5,https://www.tripadvisor.com/ShowUserReviews-g255325-d3246009-r696258741-Merewether_Beach-Newcastle_Greater_Newcastle_New_South_Wales.html
SherienneH,Merewether Beach,"Mereweather Beach Beautiful beach, great walkway and the baths are a safe place for young kids to swim
One of the nicest beaches in Newcastle",5,https://www.tripadvisor.com/ShowUserReviews-g255325-d3246009-r696171157-Merewether_Beach-Newcastle_Greater_Newcastle_New_South_Wales.html
margaretan116,Wonderful Beach,"Mereweather Beach Love Mereweather beach one of the best around .
All facilities available including great eating and coffee options very close by so need to worry about getting thirsty or hungry whilst enjoying a day here 
Like most beaches parking can be a bit hard at times but worth a little walk if you cannot find any on the esplanade",5,https://www.tripadvisor.com/ShowUserReviews-g255325-d3246009-r687609018-Merewether_Beach-Newcastle_Greater_Newcastle_New_South_Wales.html
kiernanh,Iconic surfbeach and headland.,"Mereweather Beach Great place to visit. Scenic views, bathing, great restaurant with amazing views suspended over the busy hub of activity on the boardwalk. Easily accessible.",5,https://www.tripadvisor.com/ShowUserReviews-g255325-d3246009-r686339500-Merewether_Beach-Newcastle_Greater_Newcastle_New_South_Wales.html
Scottiehere,One of the most popular..,"Mereweather Beach One of if not the most popular beach in Newie! A bit of something for everyone, apart from finding a parking spot on a busy day!!",4,https://www.tripadvisor.com/ShowUserReviews-g255325-d3246009-r683894564-Merewether_Beach-Newcastle_Greater_Newcastle_New_South_Wales.html
PicklesNewcastle,Why travel overseas when Newcastle provides the best beaches,"Mereweather Beach Merewether Beach, Bar Beach Nobbys and Newcastle provide so many opportunities to enjoy safe and relaxing experiences . They are unquestionably some of the great beaches of the world and as well provide great food and drink facilities to sit back and enjoy the view . Forget the south of France and instead spend your time in Newcastle... the beaches are free",5,https://www.tripadvisor.com/ShowUserReviews-g255325-d3246009-r683836862-Merewether_Beach-Newcastle_Greater_Newcastle_New_South_Wales.html
themerlins,Not really for young kids,Mereweather Beach Beach lols nice but very rough swell and not really suitable for toddlers and young kids. Getting dunked a lot an perhaps good for strong swimmers and surfers but seen better beaches around Australia. Can get good coffees around the place.,3,https://www.tripadvisor.com/ShowUserReviews-g255325-d3246009-r681429268-Merewether_Beach-Newcastle_Greater_Newcastle_New_South_Wales.html
Namduh1954,One of the best beaches in Australia,"Mereweather Beach White sand, cliffs in the background, surfers in the water, what else could you ask for on a bright sunny day.",5,https://www.tripadvisor.com/ShowUserReviews-g255325-d3246009-r680040341-Merewether_Beach-Newcastle_Greater_Newcastle_New_South_Wales.html
12jenko34,Merewether Beach - The best!!!!,"Mereweather Beach A great beach, good waves, great walks, the best castle views, watch the dolphins surfing the waves, why would you want to go anywhere else. Check it out for yourself.",5,https://www.tripadvisor.com/ShowUserReviews-g255325-d3246009-r679028134-Merewether_Beach-Newcastle_Greater_Newcastle_New_South_Wales.html
sheldonp558,"Nice, clean beach","Mereweather Beach I came here to stretch my legs after a bit of a drive. Not too many people here, plenty of parking around, lovely spot!",5,https://www.tripadvisor.com/ShowUserReviews-g255325-d3246009-r672036708-Merewether_Beach-Newcastle_Greater_Newcastle_New_South_Wales.html
geoffr487,Great spot,"Mereweather Beach Fantastic spot, has a great beach, ocean baths, resturants and pub, walking paths, recommend getting their early to get a park.",5,https://www.tripadvisor.com/ShowUserReviews-g255325-d3246009-r670557616-Merewether_Beach-Newcastle_Greater_Newcastle_New_South_Wales.html
AnnikadeBruijne,Excellent beach with beautiful blue water and yellow sand,Mereweather Beach A great beach - definitely a must see - highly recommend a trip here with or without the family! Easy access and okay to park etc.,5,https://www.tripadvisor.com/ShowUserReviews-g255325-d3246009-r669737444-Merewether_Beach-Newcastle_Greater_Newcastle_New_South_Wales.html
judysW9083BZ,Beach is a life,"Mereweather Beach Great beach caters for the whole family. Body surfing board riding, swimming.is a patrolled beach. Food out let great food.",5,https://www.tripadvisor.com/ShowUserReviews-g255325-d3246009-r666610513-Merewether_Beach-Newcastle_Greater_Newcastle_New_South_Wales.html
LanceN3,Merewether beach.,"Mereweather Beach Great swimming beach, patrolled majority of time.  Plenty of parking . Take away food and coffee etc with seating and amenities / toilets Showers change rooms.",5,https://www.tripadvisor.com/ShowUserReviews-g255325-d3246009-r666182327-Merewether_Beach-Newcastle_Greater_Newcastle_New_South_Wales.html
J3545OKjoanw,Mrs,Mereweather Beach We live very close to Merewether beach and it is absolutely beautiful and there are coffee places there so it is so nice to have a coffee and take in the view of the ocean,5,https://www.tripadvisor.com/ShowUserReviews-g255325-d3246009-r666174481-Merewether_Beach-Newcastle_Greater_Newcastle_New_South_Wales.html
AndyB5045,Merewether Beach,"Mereweather Beach Great beach, great swimming, great surf. The cafe has loads options for snacks, coffee is good.
The surf house has great $10 pizza options for the kids.
Great views to just sit a relax.",5,https://www.tripadvisor.com/ShowUserReviews-g255325-d3246009-r666163569-Merewether_Beach-Newcastle_Greater_Newcastle_New_South_Wales.html
Michael-4551,Merewether Beach,Mereweather Beach Visited on Thursday 14th February. This is one of the better beaches in Newcastle with plenty of parking available.,4,https://www.tripadvisor.com/ShowUserReviews-g255325-d3246009-r663677909-Merewether_Beach-Newcastle_Greater_Newcastle_New_South_Wales.html
anngrimshaw7,Full moon meditation,"Mereweather Beach Awesome beach, great place for the free Full Moon Meditation, 100's of people gather and proceed to be mesmerised by the sound of the ocean and guided meditation, such a peaceful place on earth",5,https://www.tripadvisor.com/ShowUserReviews-g255325-d3246009-r660221357-Merewether_Beach-Newcastle_Greater_Newcastle_New_South_Wales.html
porgy328,Beautiful Place,"Mereweather Beach merewether = good sandy beach , most times really good surf conditions. caters to the body surfers, boardies and adjacent is 2 open pools... 1 for littlies and the main pool for anyone which is flushed by ocean swell and also emptied Mechanically weekly...merewether has a boardwalk cafe which is most adequate...For up market dining you Merewether Surf House close by...then across the road we have the iconic Beaches Hotel.....if this is not enough further along on the same strip of beach you have Dixon Park surf club",4,https://www.tripadvisor.com/ShowUserReviews-g255325-d3246009-r659672448-Merewether_Beach-Newcastle_Greater_Newcastle_New_South_Wales.html
juliehV6727NJ,Beach walk,"Mereweather Beach Absolutely love this beach. Lovely easy walk,  lots to see and do. Oven baths to swim in,  rock pools for the kids,  great surfing,  upmarket dining or casual beach cafes on the promenade. Clean water and beach. Watch the whales and dolphins. The home of Surfest. Plenty of parking.",5,https://www.tripadvisor.com/ShowUserReviews-g255325-d3246009-r659660629-Merewether_Beach-Newcastle_Greater_Newcastle_New_South_Wales.html
AHospitalityTraveler,Beautiful location!,"Mereweather Beach Waves, Beach, Surf & Sand. A lovely beach to cool off all year round. The kiosk  opens early for coffee & a snack, plenty of seats & tables. Very clean eating facilities. You can walk down to the beach or sit near Café & watch the surfers & the waves. Bucketlist!",5,https://www.tripadvisor.com/ShowUserReviews-g255325-d3246009-r658364643-Merewether_Beach-Newcastle_Greater_Newcastle_New_South_Wales.html
863SueM,Surfer Beach,Mereweather Beach This is Newcastle’s beach known for great surfing.  A surfing competition called Surfest is held at this beach.  We saw the preparations being done while we walked the boardwalk.,4,https://www.tripadvisor.com/ShowUserReviews-g255325-d3246009-r658165431-Merewether_Beach-Newcastle_Greater_Newcastle_New_South_Wales.html
651darrinr,Cool off,"Mereweather Beach One off the classic beaches to visit has cafes ,restaurant and a beach bathe . Guards on duty change rooms clean and seats to rest. Parking limited",4,https://www.tripadvisor.com/ShowUserReviews-g255325-d3246009-r657470175-Merewether_Beach-Newcastle_Greater_Newcastle_New_South_Wales.html
Tripmax86,Excellent beach like all in the area.,"Mereweather Beach Pools are seawater, free but grubby unless recently cleaned (not so often by the look of it). Newcastle Beach baths are better looked after.",4,https://www.tripadvisor.com/ShowUserReviews-g255325-d3246009-r657090357-Merewether_Beach-Newcastle_Greater_Newcastle_New_South_Wales.html
Y5768QAjohnl,"Enormous and safe fresh saltwater pool, sandy beach, cafe and rough surf.","Mereweather Beach For average swimmers, the fresh saltwater pool is the way to go when the surf is rough. The pool is emptied and cleaned on a regular published schedule.The surf club pavilion has a cafe and restaurant with great food. Early evening is a great time at the pavilion overlooking the blue ocean.",5,https://www.tripadvisor.com/ShowUserReviews-g255325-d3246009-r656152638-Merewether_Beach-Newcastle_Greater_Newcastle_New_South_Wales.html
