user,title,text,rating,url
deepaks44,Best beach !,Mereweather Beach Bar beach is one of the best beaches in Australia. Blue and clean water with spot for kids to play. Very clean and scenic beach. I would strongly recommend visiting with family or alone if visiting Newcastle,5,https://www.tripadvisor.com/ShowUserReviews-g255325-d3246009-r564181965-Merewether_Beach-Newcastle_Greater_Newcastle_New_South_Wales.html
736TimB,"Fun, Uncrowded Surf Spot","Mereweather Beach This stretch of beach is very cool. Beautiful blue water, clean beach, and fun waves. The vibe in the water and on the beach was very relaxed and the locals are super friendly and welcoming. My son and I caught some fish surf fishing of the beach. There are really nice spots to eat on the path just above the beach. Great beach. Very similar to my local beach, Huntington Beach, CA.",5,https://www.tripadvisor.com/ShowUserReviews-g255325-d3246009-r558661322-Merewether_Beach-Newcastle_Greater_Newcastle_New_South_Wales.html
JW451,Stunning beach,"Mereweather Beach Merewether beach is stunning. Definitely worth the trip to swim in, walk along and just enjoy the scenery!",5,https://www.tripadvisor.com/ShowUserReviews-g255325-d3246009-r557266521-Merewether_Beach-Newcastle_Greater_Newcastle_New_South_Wales.html
WayneP290,Terrific Little Beach in the Heart of Newcastle,"Mereweather Beach Newcastle is spoilt for choice with many beaches dotted along the coast but Merewether Beach is a stand out for me. Parking can be hectic but well worth the hunt - toilet & change facilities are next to the beach & nearby pub & cafes make it an easy choice. Great for all the locals as well as tourists - an eclectic mix of families, joggers & tourists make it popular all around.",5,https://www.tripadvisor.com/ShowUserReviews-g255325-d3246009-r556388897-Merewether_Beach-Newcastle_Greater_Newcastle_New_South_Wales.html
jhenj621,Lunch with family,"Mereweather Beach Great food with reasonable prices and a good variety on menu, friendly staff great view over mrerweather beach front covered outdoor area.",5,https://www.tripadvisor.com/ShowUserReviews-g255325-d3246009-r555218879-Merewether_Beach-Newcastle_Greater_Newcastle_New_South_Wales.html
wtandy,Lovely Newcastle beach,"Mereweather Beach Great beach, among very many, in Newcastle. Ocean baths, expansive coastline, pathed walkway and a beach cafe. NSW at its finest. Free parking for the organised!",4,https://www.tripadvisor.com/ShowUserReviews-g255325-d3246009-r555073482-Merewether_Beach-Newcastle_Greater_Newcastle_New_South_Wales.html
troys337,Merewether Beach Southern End,Mereweather Beach Great spot for a day at the beach with the family. Nice sheltered area to the South near the Baths which is great for kids. Good break a bit North with consistently good small to medium surf. Surfclub Kiosk right behind if you need lunch and a great coffee also. Parking can be hard to find when busy due to the limited amount directly near the beach. You can park across the road and link to the beach via the road underpass walkway. No surprise that Merewether was voted the best beach in the country. Something a local Novocastrian has known for years.,5,https://www.tripadvisor.com/ShowUserReviews-g255325-d3246009-r555034911-Merewether_Beach-Newcastle_Greater_Newcastle_New_South_Wales.html
JuiceP,Breakfast on the Beach,"Mereweather Beach Great coffee shop here for Breakfast and right on the beach, food and coffee was great. Service great as well. Surf was huge and surfers having a ball.",5,https://www.tripadvisor.com/ShowUserReviews-g255325-d3246009-r554095234-Merewether_Beach-Newcastle_Greater_Newcastle_New_South_Wales.html
CBRJoshG,worth a look,Mereweather Beach its a nice beach but the parking situation is kind of crazy and its hard to get in on a weekend that said very pretty worth a look,4,https://www.tripadvisor.com/ShowUserReviews-g255325-d3246009-r552835147-Merewether_Beach-Newcastle_Greater_Newcastle_New_South_Wales.html
666heleno,Merewether Beach,"Mereweather Beach Voted as Newcastle's Best Beach and offers everything for the beach lover.  Ocean baths, surf, Merewhether Surf House, cafes, parks that are all family friendly.  Rivals Bondi any day.",5,https://www.tripadvisor.com/ShowUserReviews-g255325-d3246009-r552403804-Merewether_Beach-Newcastle_Greater_Newcastle_New_South_Wales.html
chrisbI9603LV,Iconic,"Mereweather Beach Take your pick - surf, ocean baths, the Surf Club, the Beaches Hotel, open parklands, lots of golden sand. A great all-round beach, popular for decades.",5,https://www.tripadvisor.com/ShowUserReviews-g255325-d3246009-r550980568-Merewether_Beach-Newcastle_Greater_Newcastle_New_South_Wales.html
AussieRicho1,Awesome Position.,"Mereweather Beach Close to my mates which is good but there is a club,pub,pizza place all close to the beach. Beach itself is excellent.",4,https://www.tripadvisor.com/ShowUserReviews-g255325-d3246009-r550294267-Merewether_Beach-Newcastle_Greater_Newcastle_New_South_Wales.html
Andrew_Aqua,Nice to enjoy the waves and chill,Mereweather Beach Merewether is a great spot to chill and watch the waves and the paragliding from the headland. Parking is easy and there is a cafe if you would like nibbles...,5,https://www.tripadvisor.com/ShowUserReviews-g255325-d3246009-r550213008-Merewether_Beach-Newcastle_Greater_Newcastle_New_South_Wales.html
CarolinaBetancur,Merewether beach,"Mereweather Beach The beach is closed to popular pubs, restaurants and hotels. 
Ideal for young families. It has good facilities available.",4,https://www.tripadvisor.com/ShowUserReviews-g255325-d3246009-r550157305-Merewether_Beach-Newcastle_Greater_Newcastle_New_South_Wales.html
keny700,Great place,"Mereweather Beach really enjoyed our time at Mereweather Beach & Baths, swimming in the salt water baths and then the surf before grabbing some lunch on the beach, wished we could have spent more time",4,https://www.tripadvisor.com/ShowUserReviews-g255325-d3246009-r550089482-Merewether_Beach-Newcastle_Greater_Newcastle_New_South_Wales.html
KerryH167,Just beautiful,Mereweather Beach Merewether Beach is so beautiful. Handy to restaurants. The coastline is so picturesque. Short distance to the harbour foreshore. $15 in a taxi.,5,https://www.tripadvisor.com/ShowUserReviews-g255325-d3246009-r548803377-Merewether_Beach-Newcastle_Greater_Newcastle_New_South_Wales.html
TravellerofOrange,Great views at sunrise,Mereweather Beach A short drive or walk down to the beach is worth it. What a view! Popular with surfers and fishers but enjoyed by all.,5,https://www.tripadvisor.com/ShowUserReviews-g255325-d3246009-r546150385-Merewether_Beach-Newcastle_Greater_Newcastle_New_South_Wales.html
leobowen61,Beautiful beach,"Mereweather Beach This beach is clean, and has a kiosk with lots of choices, the staff is helpful and friently, the facilities are very clean",5,https://www.tripadvisor.com/ShowUserReviews-g255325-d3246009-r544328892-Merewether_Beach-Newcastle_Greater_Newcastle_New_South_Wales.html
972basantap,summer retreat,"Mereweather Beach Beautiful beach located centrally. The amazing free swimming pool is a summer blessing. Just close to many other beaches, this is probably the best of Newcastle. Ideal place for coffee lovers, bystanders and children. Place not to be missed ....visit it for yourself and fill in the blanks .....",5,https://www.tripadvisor.com/ShowUserReviews-g255325-d3246009-r540289812-Merewether_Beach-Newcastle_Greater_Newcastle_New_South_Wales.html
KylieIsTravelling,Busy but not packed,"Mereweather Beach Last time I was here 2 years ago, Merewether Beach was overcrowded.

Surprisingly, not today. It was busy, but not packed like sardines like last time. Not sure if it's the time of day I visited today or if it's just not as packed as it used to be.

The baths are great and the beach is quite clean and spacious - one of the best in Newcastle.",4,https://www.tripadvisor.com/ShowUserReviews-g255325-d3246009-r540159709-Merewether_Beach-Newcastle_Greater_Newcastle_New_South_Wales.html
570robertb570,Best beach.,"Mereweather Beach I lived close to this beach for quite a few years.Their are actually three beaches that form one big beach,they are Bar beach,Cooks hill beach and Merewether.They are well pro trolled beaches and safe for regular and good swimmers.The beach is flat and close proximity to Newcastle city.",5,https://www.tripadvisor.com/ShowUserReviews-g255325-d3246009-r539576906-Merewether_Beach-Newcastle_Greater_Newcastle_New_South_Wales.html
bobl942,Top surf,"Mereweather Beach In my youth I surfed this south point after southerly storms,really liked the winter groundswells.Home surf of Mark Richards",5,https://www.tripadvisor.com/ShowUserReviews-g255325-d3246009-r538924236-Merewether_Beach-Newcastle_Greater_Newcastle_New_South_Wales.html
