user,title,text,rating,url
markd231,Great Beach in the heart of Newcastle,"Mereweather Beach Merewether Beach forms part of the Bar Beach, Dixon Park stretch & has a lot of facilities. Cafe's, Ocean Baths and Surf House are all nearby. Great spot to spend a day or an evening!",4,https://www.tripadvisor.com/ShowUserReviews-g255325-d3246009-r654223553-Merewether_Beach-Newcastle_Greater_Newcastle_New_South_Wales.html
W4538MOrebeccas,Something for Everyone,"Mereweather Beach Watch pink tipped waves break over the huge ocean baths at sunset. Walk along the beach promenade and watch the surfers. Stop at Merewether Surf House for a $10 pizza and beer, or go upstairs for a bar meal or dine in the restaurant.

The little ones love making sandcastles by the safe kids’ ocean pool, wash off under the outdoor showers and there are tables and chairs ideal for family picnics.

Or join the Icebergs who swim at dawn all year round.

What more could you want?",5,https://www.tripadvisor.com/ShowUserReviews-g255325-d3246009-r652219395-Merewether_Beach-Newcastle_Greater_Newcastle_New_South_Wales.html
dshah2018,Beautiful beach,"Mereweather Beach I can be biased considering local, but I am sure any one visiting this beach will be enchanted. The baths are fabulous. Very clean beach and patrolled. I don't surf but it is great for surfing I am told.",5,https://www.tripadvisor.com/ShowUserReviews-g255325-d3246009-r651837293-Merewether_Beach-Newcastle_Greater_Newcastle_New_South_Wales.html
roxyjules,Beautiful beach,Mereweather Beach This is just one of Newcastle's beautiful beaches and its also one of the best surfing beaches around.,5,https://www.tripadvisor.com/ShowUserReviews-g255325-d3246009-r651798254-Merewether_Beach-Newcastle_Greater_Newcastle_New_South_Wales.html
HoneyBub77,"Ocean baths, patrolled beach and great facilities","Mereweather Beach Love the ocean baths and rock pools.  Plenty of seating around the pools and in front of the surf club. Surf beach was patrolled, water clear and beautiful.  Adequate parking but still very busy during peak times.",5,https://www.tripadvisor.com/ShowUserReviews-g255325-d3246009-r649762725-Merewether_Beach-Newcastle_Greater_Newcastle_New_South_Wales.html
22seamusw,Beautiful Beach,Mereweather Beach Merewether Beach is my favourite beach. Beautiful headland and Merewether Ocean Baths is the perfect place to cool off with plenty of shaded areas to sit and take in the spectacular view.,5,https://www.tripadvisor.com/ShowUserReviews-g255325-d3246009-r649228821-Merewether_Beach-Newcastle_Greater_Newcastle_New_South_Wales.html
rickys763,Very good beach,Mereweather Beach Clean and well maintained beach. Excellent concrete walking path. Food and drink options also available close by. Can get busy in peak times.,5,https://www.tripadvisor.com/ShowUserReviews-g255325-d3246009-r648599823-Merewether_Beach-Newcastle_Greater_Newcastle_New_South_Wales.html
maria579,Beautiful,Mereweather Beach The beach is great & the baths there are even better for families as the water is calm & shallow. Very relaxing compared to sitting by the beach & having to stand by the waves.,5,https://www.tripadvisor.com/ShowUserReviews-g255325-d3246009-r648594944-Merewether_Beach-Newcastle_Greater_Newcastle_New_South_Wales.html
idk2019,Heaven,Mereweather Beach What can you say a piece of paradise in the heart of paradise family friendly has lifeguards what more could you want absolutely stunning Beach,5,https://www.tripadvisor.com/ShowUserReviews-g255325-d3246009-r648278462-Merewether_Beach-Newcastle_Greater_Newcastle_New_South_Wales.html
656kv,gorgeous beach with pools as a 2nd option,Mereweather Beach On the water in a boat Cruise XP Dominic's tour.Great swell 26 Dec 2018. Highly recommended for children and family.,5,https://www.tripadvisor.com/ShowUserReviews-g255325-d3246009-r647889757-Merewether_Beach-Newcastle_Greater_Newcastle_New_South_Wales.html
GladiuzM,Fantastic,"Mereweather Beach WOW what a great beach it has surfing and a great place for a swim, it had lifeguards on duty as well. It was very over case and still heaps of people enjoying the beach. 10/10 Would go back.",5,https://www.tripadvisor.com/ShowUserReviews-g255325-d3246009-r647097763-Merewether_Beach-Newcastle_Greater_Newcastle_New_South_Wales.html
INGE_2964,Stunning views,"Mereweather Beach What a Beach... Easily the Best
It has Everything.... Waves, Rockpool,Food,Pavilion,Walkway,Ocean Baths!! ENJOY",5,https://www.tripadvisor.com/ShowUserReviews-g255325-d3246009-r644649826-Merewether_Beach-Newcastle_Greater_Newcastle_New_South_Wales.html
May_J83,One of the best we've been too,"Mereweather Beach Wow! What a beach! Great area for everyone. Has the surf, also has rockpools - plus baths, and a kids beach.
Cannot fault it!
Bonus is there's a cafe/restaurant close by (which overlooks the beach). Great for fries for lunch or a popsicle.",5,https://www.tripadvisor.com/ShowUserReviews-g255325-d3246009-r643642946-Merewether_Beach-Newcastle_Greater_Newcastle_New_South_Wales.html
LynetteC697,a lovely coastal experience,Mereweather Beach on a fine day it was great to see this excellent stretch of coast with such a suitable walking path.,5,https://www.tripadvisor.com/ShowUserReviews-g255325-d3246009-r643185272-Merewether_Beach-Newcastle_Greater_Newcastle_New_South_Wales.html
D7667PQchristopherl,Went running at Merewether Beach.,"Mereweather Beach Very scenic beach. All the coast in the vicinity is stunning. Close to Merewether ocean Baths. Lots of facilities ie toilet, shower, kiosk/cafe. Life saving club and patrolled water.",5,https://www.tripadvisor.com/ShowUserReviews-g255325-d3246009-r639138539-Merewether_Beach-Newcastle_Greater_Newcastle_New_South_Wales.html
andrewbP5559OX,Home front,"Mereweather Beach Great spot for a tinnie after a Kong day at work! Beautiful beach for a swim or surf , has an annual surf festival in February",5,https://www.tripadvisor.com/ShowUserReviews-g255325-d3246009-r638936801-Merewether_Beach-Newcastle_Greater_Newcastle_New_South_Wales.html
Leslee30,Home to world champion surfers,"Mereweather Beach Training ground for many of the world surfing champions. This beach has a wonderful coastline, great restaurant/cafes and family friendly.",5,https://www.tripadvisor.com/ShowUserReviews-g255325-d3246009-r638712992-Merewether_Beach-Newcastle_Greater_Newcastle_New_South_Wales.html
raquelneric,Wonderful long Clean Sandy Surf Beach.,"Mereweather Beach Handy to Newcastle City , WonderfulBeach ; Home of World 

Surfing CHAMPION ,Mark RICHARDS .

long Beach , good for All Family . Surf Club Patrolled Beach.

Hotel and Restaurants and Cafes across road.

Safe Beach, large Car park.  Public amenities ,showers , rooms.",5,https://www.tripadvisor.com/ShowUserReviews-g255325-d3246009-r635121717-Merewether_Beach-Newcastle_Greater_Newcastle_New_South_Wales.html
julianal851,Lovely place,Mereweather Beach Beautiful beach and great for a walk. It has a very welcoming vibe. I have friends living in Newcastle and this is the favourite beach to go to.,5,https://www.tripadvisor.com/ShowUserReviews-g255325-d3246009-r634946693-Merewether_Beach-Newcastle_Greater_Newcastle_New_South_Wales.html
ProvoSenior,Windy but wonderful,"Mereweather Beach Day was recovering from constant rain. Refreshing gale and clearing sky made this a spectacular view, the surf being whipped up, swirling its way to the beach.",5,https://www.tripadvisor.com/ShowUserReviews-g255325-d3246009-r622533973-Merewether_Beach-Newcastle_Greater_Newcastle_New_South_Wales.html
Pamelajanice,Weekly walk,Mereweather Beach A lovely walk along the esplanade from Merewether beach to Bar Beach then a good coffee at either the Blue Door or further along at Surf House.,5,https://www.tripadvisor.com/ShowUserReviews-g255325-d3246009-r621601705-Merewether_Beach-Newcastle_Greater_Newcastle_New_South_Wales.html
MsLSkinner,"Baths, beach and food!","Mereweather Beach Had a drink and some food from the SLSC, amazing! Reasonably priced and tasty . The baths are lovely to swim in and there is even a seperate area for small kiddies. We also walked along the beach collecting shells. Perfect weather and a perfect day!!",5,https://www.tripadvisor.com/ShowUserReviews-g255325-d3246009-r621586608-Merewether_Beach-Newcastle_Greater_Newcastle_New_South_Wales.html
karengraysontravel,Perfect place to visit,"Mereweather Beach Ideal spot for families, couples and individuals to spend much needed r and r time.  Lots of eateries, both casual and formal. Swim at the beach, wander through the rock pools or swim in the baths.  One of my favourite places.",5,https://www.tripadvisor.com/ShowUserReviews-g255325-d3246009-r621562362-Merewether_Beach-Newcastle_Greater_Newcastle_New_South_Wales.html
pmitchell125,Merewether beach the relaxing hub,"Mereweather Beach Not just a beach but an environment where entertainment is what you make of it! From the local pub (Beach Hotel) with its breathtaking views up and down the coast line to the boardwalk cafes and restaurants for your dining requirements. Then we also have the walkways and cycle ways that follow the coastline for a relaxing walk or cycle with the sea breeze to cool you on those long hot summer days, and then why not finish off with a dip in the ocean baths or a surf on the majestic waves off Merewether.",5,https://www.tripadvisor.com/ShowUserReviews-g255325-d3246009-r621505231-Merewether_Beach-Newcastle_Greater_Newcastle_New_South_Wales.html
KatieM5477,Great breakfast with beautiful views.,Mereweather Beach Had a huge and satisfying breakfast while looking out at one of the best beaches in Australia - truly lucky to live here.,5,https://www.tripadvisor.com/ShowUserReviews-g255325-d3246009-r619004280-Merewether_Beach-Newcastle_Greater_Newcastle_New_South_Wales.html
ASTRODYNAMICS,Best beach in NSW,"Mereweather Beach Beautiful beach ,great walk around to the connecting beaches. Childrens pool available. Clean ,safe environment. Walk to the Merewether Surfhouse for coffee or a meal. I spend my summer here!!",5,https://www.tripadvisor.com/ShowUserReviews-g255325-d3246009-r614977189-Merewether_Beach-Newcastle_Greater_Newcastle_New_South_Wales.html
rosecogger,Great Beach one of the best on the east coast of Australia,Mereweather Beach Frequently swim at Merewether Beach and visit cafes which have a variety of great food wonderful ambience and there is always something to see eg....whale watching,5,https://www.tripadvisor.com/ShowUserReviews-g255325-d3246009-r613341454-Merewether_Beach-Newcastle_Greater_Newcastle_New_South_Wales.html
bobh666,Follow on from Memorial Drive,Mereweather Beach Mereweather Beach is such an icon and a must for visitors to see.great in the summer for swimming but equally nice to walk along in the winter,4,https://www.tripadvisor.com/ShowUserReviews-g255325-d3246009-r612707020-Merewether_Beach-Newcastle_Greater_Newcastle_New_South_Wales.html
sunnyandbright,Nice Beach,Mereweather Beach This is a nice beach yo visit it has good facilities . The beach is nice to swim In and walk along. A few coffee shops and also baths yo swim in.,4,https://www.tripadvisor.com/ShowUserReviews-g255325-d3246009-r611294171-Merewether_Beach-Newcastle_Greater_Newcastle_New_South_Wales.html
913janetn,Surfer's challenge,Mereweather Beach Amazing surf beach. The times that I have been there the waves have been not for the faint hearted. Great place however to watch the surfers catch waves and whales pass by.,4,https://www.tripadvisor.com/ShowUserReviews-g255325-d3246009-r611270192-Merewether_Beach-Newcastle_Greater_Newcastle_New_South_Wales.html
mytripviewasis,great views,Mereweather Beach had a nice lunch with friends at the bar that overlooks the beach was a nice sunny day and the view and the water colour was sensational we toped it off by a nice walk along the boardwalk.,4,https://www.tripadvisor.com/ShowUserReviews-g255325-d3246009-r611231766-Merewether_Beach-Newcastle_Greater_Newcastle_New_South_Wales.html
SapphireD60,Lots of water and surf,"Mereweather Beach There's often surf, rock-pools, an ocean baths, a carpark, seabirds, whales, dolphins and beach towels. I saw my first dead person here floating face down in the kiddies' pool when i was 10.",4,https://www.tripadvisor.com/ShowUserReviews-g255325-d3246009-r609475486-Merewether_Beach-Newcastle_Greater_Newcastle_New_South_Wales.html
Johnd1961,Best beach in Newcastle,"Mereweather Beach This is the best beach in Newcastle - it’s suitable for surfers, swimmers, and people of all ages. It is serviced by a surf club as well so swim between the flags. There are also a number of options to eat at the venues along its foreshore.",5,https://www.tripadvisor.com/ShowUserReviews-g255325-d3246009-r608706296-Merewether_Beach-Newcastle_Greater_Newcastle_New_South_Wales.html
P8173KLandyl,weekly run,Mereweather Beach great beach for fun and excersise.. Restraunts and pools plus miles of top beach. Parking was easy and mainly close to the beach and services,5,https://www.tripadvisor.com/ShowUserReviews-g255325-d3246009-r608314498-Merewether_Beach-Newcastle_Greater_Newcastle_New_South_Wales.html
N1648FOdavid,One of the best,Mereweather Beach if you want to visit a beach or go for stroll or eat great food this has it all within walking distance. the scenic walk is great the walkway along the beach is easy and plenty of rest spots to sit and watch the waves or cross the road and watch the action at the skate park. The best is to walk up to the Beach house and have a cold beer and look at all the action and views while enjoying a relaxing drink,5,https://www.tripadvisor.com/ShowUserReviews-g255325-d3246009-r608179113-Merewether_Beach-Newcastle_Greater_Newcastle_New_South_Wales.html
JimGargan_54,suburbia meets surf,"Mereweather Beach Merewether Beach has something to offer everyone irrespective of age or desire. Merewether Beach is situated at the southern end of an uninterupted stretch of golden sand commencing at Bar Beach and including Dixon Park Beach. All three beaches have surf clubs with licensed premises. To the south of Merewether Beach you will find Merewether Ocean Baths which comprises two pools. The smaller pool is intended for families with toddlers. The larger pool measures 100 x 50 metres. The area off the adjacent rock platform is suitable for the experienced snorkler and the more adventurous and confident swimmer. The baths were recently renovated and the amenities have hot (warm) showers. Merewether Beach (like Bar Beach and Dixon Park Beach) are patrolled by Council Life Guards on weekdays and Surf Life Saving Australia Life Savers on weekends. Swimming conditions can vary significantly depending upon tides and wind direction. Merewether Beach hosts ""Surfest"" , a international surfing competition, annually and is the home break for seven-times world surfing champion Mark Richards and NRL legend Andrew Johns. There is plenty of parking close to the beach, but very limited parking for the disabled. Surf House located between Merewether Beach and Merewether Ocean Baths has a variety of venues serving alcohol and meals for different budgets. The views are spectacular from any of these venues.",5,https://www.tripadvisor.com/ShowUserReviews-g255325-d3246009-r603687982-Merewether_Beach-Newcastle_Greater_Newcastle_New_South_Wales.html
Natalie10042105,Gorgeous part of the World,"Mereweather Beach The esplanade is full of activity! Runners, walkers, dogs, strollers-& such a beautiful view! Perfect place to grab a coffee, stroll along the beach or sit and watch the waves roll in",4,https://www.tripadvisor.com/ShowUserReviews-g255325-d3246009-r603650379-Merewether_Beach-Newcastle_Greater_Newcastle_New_South_Wales.html
suzannemdavies,Mother’s Day venue,Mereweather Beach This cafe is a special place that my family take me to for my birthday & Mother’s Day every time the view is spectacular and the meals are delicious a favourite for everyone,5,https://www.tripadvisor.com/ShowUserReviews-g255325-d3246009-r603610560-Merewether_Beach-Newcastle_Greater_Newcastle_New_South_Wales.html
pdoonan,Always Great to see.,Mereweather Beach Great sized Carpark and the traffic has been rerouted to have one way streets that make it more enjoyable.,5,https://www.tripadvisor.com/ShowUserReviews-g255325-d3246009-r597192047-Merewether_Beach-Newcastle_Greater_Newcastle_New_South_Wales.html
JamesB992,So lovely,"Mereweather Beach We had pizza and ice cream on the esplanade on a July evening and it was beautiful. I can't wait to come back and do it again in summer, glorious location.",5,https://www.tripadvisor.com/ShowUserReviews-g255325-d3246009-r596934498-Merewether_Beach-Newcastle_Greater_Newcastle_New_South_Wales.html
785judithp,"Social, relaxed, area to watch the surfers",Mereweather Beach Stopped here on our way out of town to grab a juice from the cafe and wander along the esplanade to the Merewether Baths. Could have sat here for hours watching the surfers and the passing crowd. Plenty of free parking (4hr limit),4,https://www.tripadvisor.com/ShowUserReviews-g255325-d3246009-r595695975-Merewether_Beach-Newcastle_Greater_Newcastle_New_South_Wales.html
teticat,"Good waves, great sand  and trendy cafes",Mereweather Beach Merewether beach is a great place for families and also experienced surfers.  Good facilities and  several cafes and a restaurant are close by.  It is also the site of Newcastle’s Surfest event.   Free Parking abounds,5,https://www.tripadvisor.com/ShowUserReviews-g255325-d3246009-r594813786-Merewether_Beach-Newcastle_Greater_Newcastle_New_South_Wales.html
stuartn81,Merewether beach,Mereweather Beach This is the best spot in Newcastle. Great waves if your a keen surfer. Easy parking and access to cafes and pubs and also has the Merewether ocean baths if the seas are rough.,5,https://www.tripadvisor.com/ShowUserReviews-g255325-d3246009-r594410145-Merewether_Beach-Newcastle_Greater_Newcastle_New_South_Wales.html
eaglewhiz,Worth visiting!,"Mereweather Beach Great beach with a highly accessible walkway and carpark. Very social area.Coffee shops and cafes, family activities, a great concourse for walking, bike riding etc",5,https://www.tripadvisor.com/ShowUserReviews-g255325-d3246009-r593827758-Merewether_Beach-Newcastle_Greater_Newcastle_New_South_Wales.html
ajk95,Lovely!,"Mereweather Beach My favourite beach in Newcastle. I love running from Merewether beach to Bar Beach surfhouse and back, and then take a dip in the Merewether Baths (which are right next to the beach!). Adequate parking unless it's a particularly busy weekend, and there's some decent food and drink options available.",5,https://www.tripadvisor.com/ShowUserReviews-g255325-d3246009-r593646632-Merewether_Beach-Newcastle_Greater_Newcastle_New_South_Wales.html
796camillec,My favorite beach in Newcastle,"Mereweather Beach Just near Merewether baths, this beach is not overly crowded and the view is amazing. Parking is available and way less crowded than all of the other beach. The waves might be a bit big for inexperienced swimmers, so to swim I always go to Bar Beach.",5,https://www.tripadvisor.com/ShowUserReviews-g255325-d3246009-r592878024-Merewether_Beach-Newcastle_Greater_Newcastle_New_South_Wales.html
dansworld000,One of the best beaches on the East Coast of Australia,"Mereweather Beach I lived across the road from Merewether Beach for many years and I really love this place. It has everything you can possibly want. Great surf, friendly people, a fantastic cafe that being Surf House with friendly staff, and clean ocean water. I love coming back here whenever I am in Australia.",5,https://www.tripadvisor.com/ShowUserReviews-g255325-d3246009-r589413922-Merewether_Beach-Newcastle_Greater_Newcastle_New_South_Wales.html
MarnieD01,One of the most beautiful beaches :),"Mereweather Beach Beautiful beach, great surf and a perfect place for families.  Lifeguard services, change room facilities, cafe/kiosks available, sheltered picnic areas and amazing restaurants.",5,https://www.tripadvisor.com/ShowUserReviews-g255325-d3246009-r588653960-Merewether_Beach-Newcastle_Greater_Newcastle_New_South_Wales.html
brettp307,Merewether Beach must see when in Newcastle,"Mereweather Beach Great beach and great food establishments. Walk from Merewther to Newcastle is great via memorial walkway.

Get there.",5,https://www.tripadvisor.com/ShowUserReviews-g255325-d3246009-r588630391-Merewether_Beach-Newcastle_Greater_Newcastle_New_South_Wales.html
ng_ryan,Wow.  Wonderful Views,Mereweather Beach I don't recall ever being in Merewether in perfect weather until last Saturday.  The water was very clear.  Absolutely stunning.,5,https://www.tripadvisor.com/ShowUserReviews-g255325-d3246009-r581599870-Merewether_Beach-Newcastle_Greater_Newcastle_New_South_Wales.html
425vivd,New Baths are brilliant.,Mereweather Beach Growing up in Newcastle I am proud to see the wonderful additions and improvements in t.he area since I was young,5,https://www.tripadvisor.com/ShowUserReviews-g255325-d3246009-r579559786-Merewether_Beach-Newcastle_Greater_Newcastle_New_South_Wales.html
TheTravellingFour01,Breathtaking Beach,"Mereweather Beach We are from Bondi and this beach was breathtaking, Great for young families we used the ocean baths and the rockpools it was a beautiful day! We stayed at Rydges it was a 5 minute drive around the coastline",5,https://www.tripadvisor.com/ShowUserReviews-g255325-d3246009-r575936531-Merewether_Beach-Newcastle_Greater_Newcastle_New_South_Wales.html
Zoe445,Amazing clean beach,Mereweather Beach This beach is beautiful. Clean beach. it is flagged with life guards. Also has near by ocean bars. multiples cafes with coffee and food - cheap $10 pizzas available.,5,https://www.tripadvisor.com/ShowUserReviews-g255325-d3246009-r572032710-Merewether_Beach-Newcastle_Greater_Newcastle_New_South_Wales.html
robbygc,The Active Beach,"Mereweather Beach This beach was busy. Some were surfing, others were swimming and others were sunbathing. 

Nearby people could order drinks and watch the activities on the beach.

I liked that beach! The waves were a bit stronger in this part of Newcastle. I like that!

Worthwhile to see!",5,https://www.tripadvisor.com/ShowUserReviews-g255325-d3246009-r571323871-Merewether_Beach-Newcastle_Greater_Newcastle_New_South_Wales.html
967andreem,Picture of beauty,Mereweather Beach Absolutely amazing. Very clean. Even if you don't want to go on the beach it is a beautiful walk. Sit swim or just watch.,5,https://www.tripadvisor.com/ShowUserReviews-g255325-d3246009-r570210288-Merewether_Beach-Newcastle_Greater_Newcastle_New_South_Wales.html
janel131,Great beach,"Mereweather Beach What a pleasant surprise! Went for a day trip to Mereweather beach... parking can get a little busy, but we were able to park within a short walking distance.

From the beach with room for kites, surfers on the waves, saltwater bath pools for swimming, rock pools with plenty of sea snails and hermit crabs ... my boys had a great day here! 

Scenic views if you like to walk along the stretch of the coastline. 

Would visit again!",5,https://www.tripadvisor.com/ShowUserReviews-g255325-d3246009-r567923367-Merewether_Beach-Newcastle_Greater_Newcastle_New_South_Wales.html
ErnestHillWines,Beautiful,Mereweather Beach One of the best views in the area to sit back and enjoy a wine! Strongly recommend visiting the beach after a lovely day wine tasting.,5,https://www.tripadvisor.com/ShowUserReviews-g255325-d3246009-r567789574-Merewether_Beach-Newcastle_Greater_Newcastle_New_South_Wales.html
CarmelIta2015,Getaway,"Mereweather Beach Lovely aspect overlooking the sea.
Fine cafe with some good breakfast food , always busy as it’s so popular
Have to be early as the parking is difficult",4,https://www.tripadvisor.com/ShowUserReviews-g255325-d3246009-r567571777-Merewether_Beach-Newcastle_Greater_Newcastle_New_South_Wales.html
467maureenw,Beautiful Beach,Mereweather Beach we visited when the Surfest was taking place. A good buzz to the area. Beautiful beach where our friends regularly swim and surf. A lovely place to walk around and enjoy the views. Very easy to get food as a selection of eateries by the side of the beach,5,https://www.tripadvisor.com/ShowUserReviews-g255325-d3246009-r567239532-Merewether_Beach-Newcastle_Greater_Newcastle_New_South_Wales.html
dtayck,"Beautiful beach, stunning views!","Mereweather Beach We visited Merewether Beach on our way back to Sydney as we had not been to Newcastle. We were glad we did as we had such a great time strolling along the beach and taking in the view. It has lots of benches and there is a cafe facing the sea. We were there in late morning and there were many people there, jogging or walking their dogs. The parking lots are free and convenient,and the beach is quite similar to Bondi. Highly recommended.",5,https://www.tripadvisor.com/ShowUserReviews-g255325-d3246009-r565368587-Merewether_Beach-Newcastle_Greater_Newcastle_New_South_Wales.html
City4fun,Just a beautiful beach,"Mereweather Beach Walk along the beach promenade from Dixon Park Beach to Merewether Beach and you'll see why this beach got voted Australia's No 1 city beach. A beautiful stretch of sand, often great surf, and always a spot to park - for free.
It's a favourite and my wife and I are here nearly every morning walking our 2 dachshunds and having a coffee at Blue Door cafe.",5,https://www.tripadvisor.com/ShowUserReviews-g255325-d3246009-r565173703-Merewether_Beach-Newcastle_Greater_Newcastle_New_South_Wales.html
V8359DMsamanthab,Gorgeous baths!,Mereweather Beach I could have stayed in the lovely ocean baths all day long. Covered in beautiful shells and pebbles!,5,https://www.tripadvisor.com/ShowUserReviews-g255325-d3246009-r564426216-Merewether_Beach-Newcastle_Greater_Newcastle_New_South_Wales.html
