user,title,text,rating,url
M2485BNjohnm,Awesome Aussie Beach,"North Narbeen Beach Walking from North Narrabeen to Collary is just Heavan. The Narrabeen beaches are awesome Aussie surfbeach and a must for every travler to experience.  Come on a warm sunny day and the ocean sound and cleanliness of the water will be an experience you wont forget. Feels like paradise yet so close to Sydney
Better than Bondi or Manly beaches although don't expect a lot of choices for cafes or eateries.
Its the beach your coming for!",5,https://www.tripadvisor.com/ShowUserReviews-g2034319-d589953-r338791616-North_Narrabeen_Beach-Narrabeen_Warringah_Greater_Sydney_New_South_Wales.html
961ursulas,Better then Bondi,"North Narbeen Beach First time to this beautiful beach with friends who live local.Plenty of parking & space on the beach.
Everyone was just enjoying themselves on the first day of 2016.
I definitely will  be going again.",4,https://www.tripadvisor.com/ShowUserReviews-g2034319-d589953-r336557906-North_Narrabeen_Beach-Narrabeen_Warringah_Greater_Sydney_New_South_Wales.html
stevemX8124JJ,One of the best surfing beaches in Sydney,"North Narbeen Beach Situated on the Northern Beaches of Sydney, North Narrabeen sits at the entrance of the Narrabeen Lake, a tidal lake which is generally opened to the sea.
The area offers parks, playgrounds, cafe's and restaurants all in close proximity.

The Surf Life Saving Club has a café and bar and you can sit out on the deck and enjoy coffee or a beer.
The Big 4 Caravan park is close by offering cabins and campsite - very popular throughout summer as it fronts the lake.",4,https://www.tripadvisor.com/ShowUserReviews-g2034319-d589953-r334512867-North_Narrabeen_Beach-Narrabeen_Warringah_Greater_Sydney_New_South_Wales.html
jmeem42016,Scenic but also a top surfing competition beach,North Narbeen Beach I've lived nearby to this beach for nearly 40 years.  Major (meaning international) surf competitions and at least one rock concert have been held here but its fun just to walk to the rock pool or go for a swim in the ocean.  If you like beach photos dawn is the best time and there are pelicans on the Narrabeen Lagoon where it empties into the ocean which are especially good photo subjects.  Its a great family outing place.,5,https://www.tripadvisor.com/ShowUserReviews-g2034319-d589953-r332596736-North_Narrabeen_Beach-Narrabeen_Warringah_Greater_Sydney_New_South_Wales.html
HWaus,The Best beach on Northern Beaches,"North Narbeen Beach Beautiful beach for a swimming and very famous for surfing. The oceanic pool it's one of the biggest on the area and try to watch the sunrise from there, it's just a life time experience.",5,https://www.tripadvisor.com/ShowUserReviews-g2034319-d589953-r330257785-North_Narrabeen_Beach-Narrabeen_Warringah_Greater_Sydney_New_South_Wales.html
gladys70,Wonderful sight and wonderful walking,North Narbeen Beach Wonderful for strong swimmers too - I played safe and used the lagoon and rock pools nearby - wonderful - see adjoining review,5,https://www.tripadvisor.com/ShowUserReviews-g2034319-d589953-r325966703-North_Narrabeen_Beach-Narrabeen_Warringah_Greater_Sydney_New_South_Wales.html
31mitchb,Good for kids,"North Narbeen Beach Great spot with the ocean pool and inlet for the kids to use if needed. 

Downside is that the parking can be atrocious on a popular day.",4,https://www.tripadvisor.com/ShowUserReviews-g2034319-d589953-r323783528-North_Narrabeen_Beach-Narrabeen_Warringah_Greater_Sydney_New_South_Wales.html
ChristineJ318,Great walk,"North Narbeen Beach Beautiful beach and ocean baths can walk along beach forever all the way to Manly so the sign says, a,so trail walks,very picturesque. And can have stop over at surf club for refreshments.",5,https://www.tripadvisor.com/ShowUserReviews-g2034319-d589953-r323583215-North_Narrabeen_Beach-Narrabeen_Warringah_Greater_Sydney_New_South_Wales.html
helenbL8116OB,"Relaxed and watched waves, did a lot of eating and walking.",North Narbeen Beach Such a lovely place some excellent places to eat and relax. Would love to go back and try more places to eat. Beach was so clean and also had lifeguards if you wanted to swim safely.,5,https://www.tripadvisor.com/ShowUserReviews-g2034319-d589953-r321495978-North_Narrabeen_Beach-Narrabeen_Warringah_Greater_Sydney_New_South_Wales.html
elliemunster,great beach,"North Narbeen Beach beautiful beach, great walking along the sand, beach stretches along for miles, it is  a very friendly place, people say hello as you walk pass, great place to visit.",5,https://www.tripadvisor.com/ShowUserReviews-g2034319-d589953-r319707069-North_Narrabeen_Beach-Narrabeen_Warringah_Greater_Sydney_New_South_Wales.html
sarahmE1555HJ,Great Experience,"North Narbeen Beach We had great weather to visit the beach. Plenty of space to walk, swim and laze around without feeling too crowded.",4,https://www.tripadvisor.com/ShowUserReviews-g2034319-d589953-r316160662-North_Narrabeen_Beach-Narrabeen_Warringah_Greater_Sydney_New_South_Wales.html
Ellemay,lovely !,"North Narbeen Beach North Narrabeen is apart of Narrabeen Beach &  includes Birdwood Park and Narrabeen Lagoon located on the Northern Peninsula. If wanting a secluded private beach North Narrabeen has plenty of space & is not crowded like Manly or Dee Why. 

 Narrabeen Lakes, which is a very popular spot for families and water sports, such as rowing, fishing, boating, windsurfing, canoeing, sailing, waterskiing, and kayaking. This is a great beach for learners. The Lakes are situated around numerous reserves, which also contain Narrabeen Caravan Park, which is a Sydney icon. 

There are some excellent walking tracks around the lagoon and lakes. South Narrabeen Beach is located at the end of Clarke Street; it has a surf club with facilities. Narrabeen Beach also has a surf club with plenty of cafes and restaurants available.

North Narrabeen is famous for being one of the best surf breaks in the world, many world championship competitions are held here regularly. The reason the surf is so good is because of “Shark Alley” a deep channel and with the lagoon emptying into the sea creates a sandbar, which then produces extraordinary waves.  

By transport catch the 182 L87, L88 or L90 from Wynyard or the bus 155 or 157 from Manly. 

Plenty of facilities are available including change rooms, toilets, showers, & parking .",5,https://www.tripadvisor.com/ShowUserReviews-g2034319-d589953-r311941597-North_Narrabeen_Beach-Narrabeen_Warringah_Greater_Sydney_New_South_Wales.html
MoiraEt,Clean surf beach,"North Narbeen Beach Beautiful clean and well-maintained surf beach, perfect for surf board riding or swimming.  There is a cafe at the beach which is no doubt popular in the summer.",5,https://www.tripadvisor.com/ShowUserReviews-g2034319-d589953-r299339277-North_Narrabeen_Beach-Narrabeen_Warringah_Greater_Sydney_New_South_Wales.html
Josi_08,Beautiful,North Narbeen Beach Beautifully clean with soft sand. Being on a business trip I only managed a few early morning walks but it was stunning.,5,https://www.tripadvisor.com/ShowUserReviews-g2034319-d589953-r294890010-North_Narrabeen_Beach-Narrabeen_Warringah_Greater_Sydney_New_South_Wales.html
MElkhodr,Pristine,North Narbeen Beach I love going to this beach. It is still very pristine and beautiful. Not so crowded as Manly or Dee why. It is worth a visit if you are seeking some alone time or some romantic time with your partner.,5,https://www.tripadvisor.com/ShowUserReviews-g2034319-d589953-r273153975-North_Narrabeen_Beach-Narrabeen_Warringah_Greater_Sydney_New_South_Wales.html
GeoffBenstead,"Crashing waves, beach-side pool or a gentle lagoon - your choice","North Narbeen Beach I just love North Narrabeen with its deep yellow sand falling down to a good surf beach.  The swimming pool at the end,  nestled under the cliffs and then the lagoon which is great for kids and adults alike. Its got the lot.",5,https://www.tripadvisor.com/ShowUserReviews-g2034319-d589953-r262549424-North_Narrabeen_Beach-Narrabeen_Warringah_Greater_Sydney_New_South_Wales.html
GarryMilne62,Fabulous Spot,"North Narbeen Beach Great location, great beaches, excellent restaurants, great transport link to city and Manly. Plenty of good cafes, access to beach is plentiful, the lakes are on your doorstep as is good cycling routes and golf courses.",5,https://www.tripadvisor.com/ShowUserReviews-g2034319-d589953-r254076931-North_Narrabeen_Beach-Narrabeen_Warringah_Greater_Sydney_New_South_Wales.html
LisaW744,An amazing stretch of beach,"North Narbeen Beach Long, clean, uncrowded, world class surf beach and one of the best in Sydney.  Lots of places to park, multiple surf clubs with eateries and a kid safe lagoon entrance to the northern end of the beach.

Walk, surf, swim, run, kite surf or just sit.  Narrabeen is good for all.  Its a quintessential Aussie beach icon.",5,https://www.tripadvisor.com/ShowUserReviews-g2034319-d589953-r249748811-North_Narrabeen_Beach-Narrabeen_Warringah_Greater_Sydney_New_South_Wales.html
905nele,Great Beach,North Narbeen Beach Love the Beach so close to the motel and great surf! Highly recommend any time! It be back next year,5,https://www.tripadvisor.com/ShowUserReviews-g2034319-d589953-r249399590-North_Narrabeen_Beach-Narrabeen_Warringah_Greater_Sydney_New_South_Wales.html
charlseyc,best surf out,"North Narbeen Beach Love the surf.
Family friendly areas as well such as the little lake area.
Short walk to food and transport :)",4,https://www.tripadvisor.com/ShowUserReviews-g2034319-d589953-r243974816-North_Narrabeen_Beach-Narrabeen_Warringah_Greater_Sydney_New_South_Wales.html
110suem,North Narrabeen Beach,"North Narbeen Beach Large expanse of beach with a surf club.
Wooden boardwalks and seating at some access points.
Good cafes nearby.",3,https://www.tripadvisor.com/ShowUserReviews-g2034319-d589953-r237631848-North_Narrabeen_Beach-Narrabeen_Warringah_Greater_Sydney_New_South_Wales.html
Huxter09,Surf Paradise,"North Narbeen Beach My S-I-L surfs here every morning, has done for 10 years and rates it his favourite break. All along this stretch of beach good surf is found. We often sit on the cliff tops and watch him and others. There is a seawater pool here too which is very popular. Lots of surf fisherfolk when the tides are right . Good beach top cafes too and we love the cheap and cheerful one opposite the Surf Club. Upmarket dining too next to the main car park . Beautiful area with a mix of young surfers and older more affluent residents all having fun on the beach.",5,https://www.tripadvisor.com/ShowUserReviews-g2034319-d589953-r230610327-North_Narrabeen_Beach-Narrabeen_Warringah_Greater_Sydney_New_South_Wales.html
791craigt,Surf beach and calm lagoon for the kids,North Narbeen Beach Great surf beach where Narrabeen Lakes enters the ocean. Ocean pool and walks up onto the headland give great views along the coast. The lagoon side of the dunes provides a calm and shallow beach for littlies or those not confident in the surf. Also a few cafes and restaurants for refreshment close to the car park.,4,https://www.tripadvisor.com/ShowUserReviews-g2034319-d589953-r230453297-North_Narrabeen_Beach-Narrabeen_Warringah_Greater_Sydney_New_South_Wales.html
Whitehavengirl43,a stunningly beautiful beach,North Narbeen Beach Narrabeen lagoon enters the sea here and creates a surfers dream break. The large rockpool is a swimmer's delight.,5,https://www.tripadvisor.com/ShowUserReviews-g2034319-d589953-r222762732-North_Narrabeen_Beach-Narrabeen_Warringah_Greater_Sydney_New_South_Wales.html
sallyr948,Scenic,"North Narbeen Beach Peaceful...tranquil setting...one could get out..mediate, take photos re relive memories of a nice drive out to Narrabeen",5,https://www.tripadvisor.com/ShowUserReviews-g2034319-d589953-r214373406-North_Narrabeen_Beach-Narrabeen_Warringah_Greater_Sydney_New_South_Wales.html
cala9,views great,North Narbeen Beach Loved walking along the beach and taking photographs from the headlands.  But sand is soft and walking hard work,4,https://www.tripadvisor.com/ShowUserReviews-g2034319-d589953-r212265400-North_Narrabeen_Beach-Narrabeen_Warringah_Greater_Sydney_New_South_Wales.html
TomL103,Love this place,"North Narbeen Beach Childhood dreams bought me back here. Just love this place. Give the busy Bondi and Manly a miss and visit this place. If you want to leave the crowds behind and make the most of a good surf, then this beach is it. Scored 10 out of 10 with my lovely bride and bought back great memories.",5,https://www.tripadvisor.com/ShowUserReviews-g2034319-d589953-r210894098-North_Narrabeen_Beach-Narrabeen_Warringah_Greater_Sydney_New_South_Wales.html
brandona963,Excellent/Quiet beach. Good place for entire family.,North Narbeen Beach Spent some time here swimming and building sand structures. This place has an amazing atmosphere that's good for the entire family.,5,https://www.tripadvisor.com/ShowUserReviews-g2034319-d589953-r208472509-North_Narrabeen_Beach-Narrabeen_Warringah_Greater_Sydney_New_South_Wales.html
RonWamberal,Good northern suburbs beach,North Narbeen Beach Lacks the popularity (and crowds) of say Manly and Bondi.  A good beach for relaxing and good for families.,4,https://www.tripadvisor.com/ShowUserReviews-g2034319-d589953-r199474020-North_Narrabeen_Beach-Narrabeen_Warringah_Greater_Sydney_New_South_Wales.html
20Aprelle,Family time,North Narbeen Beach Seeing family again after a long absence lots of new friends and new family for first time too much traffic noise  and too much rush around Xmas time,4,https://www.tripadvisor.com/ShowUserReviews-g2034319-d589953-r189547307-North_Narrabeen_Beach-Narrabeen_Warringah_Greater_Sydney_New_South_Wales.html
eDinkum,PEACEFUL,"North Narbeen Beach It was a Peaceful relaxing weekend. Fun on the beach and rocks.
It was just a short walk across the road to the beach........",5,https://www.tripadvisor.com/ShowUserReviews-g2034319-d589953-r164545812-North_Narrabeen_Beach-Narrabeen_Warringah_Greater_Sydney_New_South_Wales.html
ManuellM_13,FUN!,"North Narbeen Beach North Narrabeen Beach is great, with the rapids, the pool, the lagoon and the surf to choose from everyone was happy! Whether floating down the rapids or cathcing a wave in the surf everyone was happy",5,https://www.tripadvisor.com/ShowUserReviews-g2034319-d589953-r153265526-North_Narrabeen_Beach-Narrabeen_Warringah_Greater_Sydney_New_South_Wales.html
kb33263,North Narrabeen Beach,"North Narbeen Beach Gorgeous beach !  Fantastic surfing early on Sunday mornings. 
Never too crowded. Beautiful crescent shape.",5,https://www.tripadvisor.com/ShowUserReviews-g2034319-d589953-r149966605-North_Narrabeen_Beach-Narrabeen_Warringah_Greater_Sydney_New_South_Wales.html
wombie03,North Narrabeen - Wonderful - I Live 2 Blocks Away,"North Narbeen Beach This is a great camping area nearby as well as a really easy bus to the City.  If I were to come to Sydney as a tourist from the country looking for a baeach holiday, I would pick this.  

Would also recommend for overseas visitors looking for a great spot to experience Sydney up a little on the Norther Beaches area.",5,https://www.tripadvisor.com/ShowUserReviews-g2034319-d589953-r144729556-North_Narrabeen_Beach-Narrabeen_Warringah_Greater_Sydney_New_South_Wales.html
Cristina106,North Narrabeen Beach,North Narbeen Beach This beach use to be my favourite beach mainly because it is a quiet beach not as popular as other beaches in sydney. But still a safe lovely each to go to.,4,https://www.tripadvisor.com/ShowUserReviews-g2034319-d589953-r141064157-North_Narrabeen_Beach-Narrabeen_Warringah_Greater_Sydney_New_South_Wales.html
ChrisAbbott,Great spot on the Nthn Beaches,North Narbeen Beach If your into surfing this place is Epic. So many famous surfers have hailed from here. It is very quiet and a nice part of the Nth Shore of Sydney.,5,https://www.tripadvisor.com/ShowUserReviews-g2034319-d589953-r140884493-North_Narrabeen_Beach-Narrabeen_Warringah_Greater_Sydney_New_South_Wales.html
SasD5,Don't miss the Ocean Pool!,"North Narbeen Beach If you want to have a beautiful swim, take memorable photos, explore some rock pools visit the Ocean Pool at North Narra. Take caution if crossing the lake entrance as there are oysters which yield a nasty cut if not careful. Nice and quiet in winter, but busy in Summer. Council cleans the pool weekly so it is always lovely for some laps or a frolic.",5,https://www.tripadvisor.com/ShowUserReviews-g2034319-d589953-r139341293-North_Narrabeen_Beach-Narrabeen_Warringah_Greater_Sydney_New_South_Wales.html
U5483MRmarks,The best of both worlds!!,"North Narbeen Beach Whether you like the motion of the ocean or the stillness of the lake, North Narrabeen has it all. A popular family destination that caters for surfing, camping, fishing, sunbaking, swimming and cuisine which makes this location a truly unique spot in Sydney.",4,https://www.tripadvisor.com/ShowUserReviews-g2034319-d589953-r131898049-North_Narrabeen_Beach-Narrabeen_Warringah_Greater_Sydney_New_South_Wales.html
Robyn25,Take time to have a look around,"North Narbeen Beach Narrabeen and North Narrabeen are approx. 40 minutes North of the CBD. You can get there by bus or car. Narrabeen sits between the beach and the shores of a lake/lagoon. At first glance it doesn't seem much but get out and walk around. The lake has a shared path all the way around that is great for an easy ride or long walk. At present (May) the lake has a family of black swans visiting. And has huge numbers of ducks and other sea bird life around and in it. You can walk over the classic concrete bridge and under some pelicans that seem to sit on the light poles, there all day. Under the bridge, people fish (I saw a guy catch a huge flathead from there) and there are swallow nests built into the foundations. There are heaps of small cafes spread through out Narrabeen that do great coffee, The Deli on Waterloo was lovely, Waterloo is the name of the street it is on. Most of the people seem friendly and bike riding is an easy way to get around here. There are farmers markets on during the day on Fridays behind the caravan park. Narrabeen has an amazing headland that  looks out to Long Reef and has a great walking track  around it. And of course it has a good surf beach and a well maintained rock pool. The caravan park is rated as one of the best in Australia but it does have a price to go with it. Just North of Narrabeen is Warriewood, which also has great cafes and a lovely little beach and headland walks. The sunrises are beautiful and the water is still warmish.",4,https://www.tripadvisor.com/ShowUserReviews-g2034319-d589953-r130264067-North_Narrabeen_Beach-Narrabeen_Warringah_Greater_Sydney_New_South_Wales.html
jiffypauley,"Narrabeen Markets, 3rd Sunday of every month!","North Narbeen Beach This a great Market at North Narrabeen right on the lake, with a full range of different stores, from clothes to handcrafts, plants, fruit and vege and yummy food stores as well. There also is this great store there that takes moulds of babies hands and feet they then compile it into a nice frame with a photo, really good gift idea.
Worth a wander and look if you are around the Northern Beaches!",5,https://www.tripadvisor.com/ShowUserReviews-g2034319-d589953-r124935730-North_Narrabeen_Beach-Narrabeen_Warringah_Greater_Sydney_New_South_Wales.html
Andoya,Ozone -,"North Narbeen Beach Traditional holiday destination at the caravan park for many country families during the summer Christmas break.  Safe, clean tidal lake for swimming with children; surf side perfect for catching a wave. Cafes; bike riding; patrolled surf beach; ocean pool; hire a canoe; the perfect summer destination 40 minutes approx from the centre of Sydney.",5,https://www.tripadvisor.com/ShowUserReviews-g2034319-d589953-r122506441-North_Narrabeen_Beach-Narrabeen_Warringah_Greater_Sydney_New_South_Wales.html
