user,title,text,rating,url
barbierikab,Nice beach but be careful,North Narbeen Beach Beautiful beach and very long so it is ideal for long walks. On both sides of the beach there are saltwater pools. Pay attention to the signs as there are dangerous currents and it is always full of Portuguese man o' war jellyfish.,5,https://www.tripadvisor.com/ShowUserReviews-g2034319-d589953-r942974876-North_Narrabeen_Beach-Narrabeen_Warringah_Greater_Sydney_New_South_Wales.html
onmailgaurav,Endless views of the ocean,"North Narbeen Beach Beautiful beach and great sunset views, and if you are lucky you can spot whales during mating season, endless views of the ocean.",5,https://www.tripadvisor.com/ShowUserReviews-g2034319-d589953-r828724691-North_Narrabeen_Beach-Narrabeen_Warringah_Greater_Sydney_New_South_Wales.html
reise686,"Beautiful beach, lagoon, walks and rock pool","North Narbeen Beach Narrabeen beach has so much to offer. Including exposed rocks during low tide, a lagoon that is located next to the rock pool. Long sandy beach to go on a nice long walk or bi-centennial coastal walk up the coast to Warriewood beach and further.",5,https://www.tripadvisor.com/ShowUserReviews-g2034319-d589953-r762182517-North_Narrabeen_Beach-Narrabeen_Warringah_Greater_Sydney_New_South_Wales.html
JElliot32,A Mecca for surfers,"North Narbeen Beach North Narrabeen has long been renowned for having some of the best, most consistent waves on the East Coast and along the way the area has produced some of Australia's most famous surfers. From the lookout on the point at the northern end of the beach you can see the current crop ply their skills. (Just look for the crowd of onlookers with cameras.)
If you are not a red-hot surfer North Narrabeen still has plenty to offer. There are very good ocean baths also at the north end that attract families and serious lap swimmers. The beach is also very long, extending several kms to Collaroy Beach in the south. Very good for a long beach walk and there are plenty of uncrowded (though also unpatrolled) sections along the way too.",5,https://www.tripadvisor.com/ShowUserReviews-g2034319-d589953-r760584342-North_Narrabeen_Beach-Narrabeen_Warringah_Greater_Sydney_New_South_Wales.html
Ellemay,Beautiful beach  ‍♂️‍♀️,"North Narbeen Beach North Narrabeen beach is nestled bedside Narrabeen lagoon and has a stunning Rockpool and a long sandy beach which is fabulous for surfing . 

Walking around the lagoon is also excellent for all age groups with a dedicated pathway for bicycles and pedestrians. The lagoon also has several beautiful spots for swimming, fishing or canoeing . 

North Narrabeen beach is located on the northern beaches 25km north of the CBD.",5,https://www.tripadvisor.com/ShowUserReviews-g2034319-d589953-r752952765-North_Narrabeen_Beach-Narrabeen_Warringah_Greater_Sydney_New_South_Wales.html
bronwynm676,Lovely Beach,North Narbeen Beach Swimming in our oceans with life guards and on North Narrabeen is a gr888t day out at the beach for anyone,4,https://www.tripadvisor.com/ShowUserReviews-g2034319-d589953-r749829936-North_Narrabeen_Beach-Narrabeen_Warringah_Greater_Sydney_New_South_Wales.html
Oscarsmith7,Perfect place,"North Narbeen Beach Absolutely beautiful spot. Love the ocean rockpool, which is excellent for recreational or lap swimming. The headland and inlet are fantastic",5,https://www.tripadvisor.com/ShowUserReviews-g2034319-d589953-r734515399-North_Narrabeen_Beach-Narrabeen_Warringah_Greater_Sydney_New_South_Wales.html
SandyT379,Beautiful Beach for walking or Surfing,"North Narbeen Beach Fabulous beach, with excellent waves for surfing. Clean and picturesque.  Has a great rock pool for swimming as well, and the lagoon, but this needs to be open to the surf, for optimum water quality.",5,https://www.tripadvisor.com/ShowUserReviews-g2034319-d589953-r732992306-North_Narrabeen_Beach-Narrabeen_Warringah_Greater_Sydney_New_South_Wales.html
djbdwb,"North Narrabeen Surf Life Saving Club. Has a hideaway cafe/restaurant, that is not mentioned in Trip Adviser.","North Narbeen Beach With “eat in or alfresco” on the balcony overlooking the surf & sand. My daughters & I had a delicious meal, and great coffee. It is so good we often eat there, . Prices reasonable. Casual dress. So relaxing watching the waves roll in! Hidden gem!",5,https://www.tripadvisor.com/ShowUserReviews-g2034319-d589953-r717538727-North_Narrabeen_Beach-Narrabeen_Warringah_Greater_Sydney_New_South_Wales.html
Shaghil,Amazing Beach,"North Narbeen Beach A very nice beach, wasn't busy when we were there but we were told by locals that it does get very busy in Summer. Most public car parking is paid parking and actively monitored by Council.",5,https://www.tripadvisor.com/ShowUserReviews-g2034319-d589953-r710681960-North_Narrabeen_Beach-Narrabeen_Warringah_Greater_Sydney_New_South_Wales.html
Z8468NNpauls,Great beach,"North Narbeen Beach Maybe I shouldn't tell people as I love this place. Great for taking photos at sunrise or sunset, as you can see both East and West. You can swim in the surf or in the rock pool.",5,https://www.tripadvisor.com/ShowUserReviews-g2034319-d589953-r672376752-North_Narrabeen_Beach-Narrabeen_Warringah_Greater_Sydney_New_South_Wales.html
georgehappy,breathtaking,"North Narbeen Beach great beach, was very quiet when I went there, we had a great time. it's a sandy beach with great sunset view",5,https://www.tripadvisor.com/ShowUserReviews-g2034319-d589953-r667269403-North_Narrabeen_Beach-Narrabeen_Warringah_Greater_Sydney_New_South_Wales.html
Ultravixen,Lovely ocean pool,North Narbeen Beach North Narrabeen Rockpool: this is an ocean pool on a point so it has a good view on three sides. The path from the car park is flat and not too long. The pool bottom is sandy and it has a nice wooden boardwalk where you can leave your stuff. Would be better at high tide with waves crashing all around.,4,https://www.tripadvisor.com/ShowUserReviews-g2034319-d589953-r658192006-North_Narrabeen_Beach-Narrabeen_Warringah_Greater_Sydney_New_South_Wales.html
shaunr464,Surfs up,North Narbeen Beach Like all the Northern Beaches crashing waves and sand. Make sure you swim between the flags there can be a significant sweep.,4,https://www.tripadvisor.com/ShowUserReviews-g2034319-d589953-r655912954-North_Narrabeen_Beach-Narrabeen_Warringah_Greater_Sydney_New_South_Wales.html
gcogar,One of the best beaches in Sydney,"North Narbeen Beach I grew up around here and love this beach, go there most weekends in Summer for a walk and/or a swim",5,https://www.tripadvisor.com/ShowUserReviews-g2034319-d589953-r652238051-North_Narrabeen_Beach-Narrabeen_Warringah_Greater_Sydney_New_South_Wales.html
Atlantis19,North Narra has everything!,"North Narbeen Beach A beautiful patrolled beach on the Northern Beaches of Sydney. Glorious rockpool for pottering and looking at the lcoal rock life plus for the kids the opening of the Lagoon comes in from the sea and there is a wonderfully safe and clean Lagoon area to swim. Plenty of Cafes are close by and the North Narrabeen Surf Club has a functioning Bar Friday, Saturday and Sunday afternoon/evenings where you can sit on the balcony overlooking the azure beachfront and enjoy a cold one or two. PARADISE!",5,https://www.tripadvisor.com/ShowUserReviews-g2034319-d589953-r651897163-North_Narrabeen_Beach-Narrabeen_Warringah_Greater_Sydney_New_South_Wales.html
Bayldo,Great beach,North Narbeen Beach Love Nth Narrabeen. Never over the top busy with people and huge beach area. Add to that the lake and pool at the northern end and you can’t ask for more.,4,https://www.tripadvisor.com/ShowUserReviews-g2034319-d589953-r646699223-North_Narrabeen_Beach-Narrabeen_Warringah_Greater_Sydney_New_South_Wales.html
Melanie_OZ1,Great at sunrise & Sunset,"North Narbeen Beach Enjoy your time at the beach & then enjoy great coffee & food at the local cafe opposite the beach.

Great for an early walk & dip in the ocean.",4,https://www.tripadvisor.com/ShowUserReviews-g2034319-d589953-r646197891-North_Narrabeen_Beach-Narrabeen_Warringah_Greater_Sydney_New_South_Wales.html
Compass2101,For Experienced Surfers only,North Narbeen Beach Great surf spot.  Swell magnetic.  Orangish sand.  Very localised / heavy crew. Intermediate level wave.  Don't bother surfing here unless you're experienced and an expert.  Others won't get waves. Body boarders sre not made welcome. Surfing royalty are out in the line up most good days,5,https://www.tripadvisor.com/ShowUserReviews-g2034319-d589953-r645046557-North_Narrabeen_Beach-Narrabeen_Warringah_Greater_Sydney_New_South_Wales.html
johndoeu999,Narrabeen - Not a good place to visit,"North Narbeen Beach An very undeveloped area. Internet is still ADSL1 which is very out-of-dated (even using Telstra network). You will find it hard to surf the internet sometimes. Limited shops and cafe, nothing much to do except the beach. Foods in Narrabeen are terrible. Not recommend unless you grew up from bush.",1,https://www.tripadvisor.com/ShowUserReviews-g2034319-d589953-r644871303-North_Narrabeen_Beach-Narrabeen_Warringah_Greater_Sydney_New_South_Wales.html
522sallyl,Beautiful beach,North Narbeen Beach What a fabulous beach with a lake as well (great for younger children). There is surf patrol too so it is safe if you want to go body surfing (or surfing).,5,https://www.tripadvisor.com/ShowUserReviews-g2034319-d589953-r617378420-North_Narrabeen_Beach-Narrabeen_Warringah_Greater_Sydney_New_South_Wales.html
TravellerAlpha,Great lunch and very good coffee,"North Narbeen Beach Been here a couple of times , sometimes for a coffee ,  or breakfast and others for lunch . 

Very friendly team , fresh ingredients, and again great coffee . Location is also one of the nicest hangouts on North Narrabeen",4,https://www.tripadvisor.com/ShowUserReviews-g2034319-d589953-r605264181-North_Narrabeen_Beach-Narrabeen_Warringah_Greater_Sydney_New_South_Wales.html
VortexChook,North Narrabeen Beach,"North Narbeen Beach A slice of heaven on the northern beaches.
The beach is great for surfing with a right to left break from the point.
the beach can be a bit rough for swimming but the lagoon that can be accessed from the road or the beach is just perfict",5,https://www.tripadvisor.com/ShowUserReviews-g2034319-d589953-r594816273-North_Narrabeen_Beach-Narrabeen_Warringah_Greater_Sydney_New_South_Wales.html
sheldonp558,Great location and beach,"North Narbeen Beach This place is superb all year long. It is more than just a summer destination, and a lot of walking all over the place. The surf can get hectic sometimes so beware. And enjoy!!",5,https://www.tripadvisor.com/ShowUserReviews-g2034319-d589953-r593474716-North_Narrabeen_Beach-Narrabeen_Warringah_Greater_Sydney_New_South_Wales.html
Bubbo61,North Narrabeen Beach,"North Narbeen Beach One of the longest beaches in Sydney, North Narrabeen is a great place to visit. The Northern End has cafes, is near the caravan park and has a beach pool. It can get rough at times but the lagoon just behind the dunes is a great place for young families when the water mouth is open to the sea. Remember to always swim between the flags.",4,https://www.tripadvisor.com/ShowUserReviews-g2034319-d589953-r588266514-North_Narrabeen_Beach-Narrabeen_Warringah_Greater_Sydney_New_South_Wales.html
shalpal76,best place on earth.,North Narbeen Beach What more can you say about the best beach on earth. when the lake is open and the sun is out where else would you rather be.,5,https://www.tripadvisor.com/ShowUserReviews-g2034319-d589953-r579752411-North_Narrabeen_Beach-Narrabeen_Warringah_Greater_Sydney_New_South_Wales.html
19DavidM47,Classic Northern Beaches destination,"North Narbeen Beach Good sea water pool if the sea is too rough or you just want a leisurely swim, but a great beach for surfing or just diving through the waves. Good loo with changing facilities, car park about 150 yds from pool, with small cafe nearby. Life guards on duty with flagged areas most of the time, never seen it too busy.",4,https://www.tripadvisor.com/ShowUserReviews-g2034319-d589953-r576804585-North_Narrabeen_Beach-Narrabeen_Warringah_Greater_Sydney_New_South_Wales.html
621AndrewM,A week in Narrabeen,"North Narbeen Beach North Narrabeen  Narabeen is a great beach , can stroll along the sand there is a park and playground at one end and the rock pool and park at the other 
If you are a surfer it looks good , certainly good for a swim but like all the Northern Beaches swim in the flags and ask the locals for advice on where is best to swim
Quite a few cafes close to the beach 
Just a good beach for lots of activities , parking around the area is both metered and free",4,https://www.tripadvisor.com/ShowUserReviews-g2034319-d589953-r571789591-North_Narrabeen_Beach-Narrabeen_Warringah_Greater_Sydney_New_South_Wales.html
stinkwink,Three in one.,"North Narbeen Beach Narrabeen beach offers you three places in one. If you have some small children with you, the Narrabeen lagoon or the rock pool is for you. If you’re a surfer or just prefer the ocean, go to the beach. All the three of them are next to each other.",4,https://www.tripadvisor.com/ShowUserReviews-g2034319-d589953-r568789325-North_Narrabeen_Beach-Narrabeen_Warringah_Greater_Sydney_New_South_Wales.html
whalank,great for sunrise photography,North Narbeen Beach stunning ocean bath and beautiful long beach to walk along.classic Australian beach with bright sand and curling waves..depending on weather off course. lots of walking to be done.,4,https://www.tripadvisor.com/ShowUserReviews-g2034319-d589953-r556593768-North_Narrabeen_Beach-Narrabeen_Warringah_Greater_Sydney_New_South_Wales.html
GGCC4,Great spot with cafe. Parking is a hassle,"North Narbeen Beach As with all good beaches in Sydney parking is the main hassle. 
Helps if you have a Warringah parking permit so you can park for a couple of hours for free. It is one of the better beaches for finding a parking spot. On a hot day get there before 9/10am to find a spot. 
Life saving club at Narrabeen beach is great for refreshments such as smoothies and coffee or a light bite to eat. 
Well patrolled along the beach. Not as crowded as Manly or Bondi.",5,https://www.tripadvisor.com/ShowUserReviews-g2034319-d589953-r555079523-North_Narrabeen_Beach-Narrabeen_Warringah_Greater_Sydney_New_South_Wales.html
K4670ZHfrankc,Lovely beach with many places to explore,"North Narbeen Beach Beach had much to offer and less crowded compared to Manly. Parking could be expensive for $8 per hour and $28 for a day. 
Walk along beach to north or south; or dip in the rock pool.",4,https://www.tripadvisor.com/ShowUserReviews-g2034319-d589953-r549689376-North_Narrabeen_Beach-Narrabeen_Warringah_Greater_Sydney_New_South_Wales.html
Oscarsmith7,Love the rockpool,North Narbeen Beach Great spot! The rockpool is a perfect oasis to enjoy a swim. Lights come on around sunset as well so it is delightful into the evening,5,https://www.tripadvisor.com/ShowUserReviews-g2034319-d589953-r547994940-North_Narrabeen_Beach-Narrabeen_Warringah_Greater_Sydney_New_South_Wales.html
aubsn,"Great most of the year round, the pool gets dirty in peak summer",North Narbeen Beach Recently renovated lakeside picnic area  just up from the main car park makes it a great place to have a swim and chill out all day. A good place to take a beach walk from Narrabeen to Collaroy. In summer the ocean pool can get dirty and doesn't flush often enough,3,https://www.tripadvisor.com/ShowUserReviews-g2034319-d589953-r502346037-North_Narrabeen_Beach-Narrabeen_Warringah_Greater_Sydney_New_South_Wales.html
ds77762,Wonderful Beach,North Narbeen Beach This was my first visit and I was very impressed! Lovely views and golden sand! We visited in the winter and water was warm when we paddled our feet. We spoke to a local surfer and he commented how warm the water was although the temperature out of the water was a lot colder. I'll certainly be back in the summer!,5,https://www.tripadvisor.com/ShowUserReviews-g2034319-d589953-r499598995-North_Narrabeen_Beach-Narrabeen_Warringah_Greater_Sydney_New_South_Wales.html
BBBernyB,Great local beach with a long sea frontage,"North Narbeen Beach Right near the Narrabeen lakes entry the beach is nice and long with plenty of room for everyone. 
Top of the beach (Northern End) has the small channel leading to the lakes. This creates a large shallow area for families especially young kids to play safely and enjoy the water without the waves. The beach front has lots of access and good swimming as well as surfing . 
Clean sand, attracts a lot of people while having space for everyone and close by access to shops for takeaway and general groceries to stay happy and entertained on or near the beach.",5,https://www.tripadvisor.com/ShowUserReviews-g2034319-d589953-r475228625-North_Narrabeen_Beach-Narrabeen_Warringah_Greater_Sydney_New_South_Wales.html
annrJ4699YA,Nice Quiet Beach,"North Narbeen Beach Northern beaches are quite nice.  This once was not over crowed, peaceful and I enjoyed the lovely views.",5,https://www.tripadvisor.com/ShowUserReviews-g2034319-d589953-r467594556-North_Narrabeen_Beach-Narrabeen_Warringah_Greater_Sydney_New_South_Wales.html
Oscarsmith7,Great beach,North Narbeen Beach Nice beach - I especially enjoyed the rock pools to the north end. Beware of the inlet - it was roaring along.,4,https://www.tripadvisor.com/ShowUserReviews-g2034319-d589953-r453478631-North_Narrabeen_Beach-Narrabeen_Warringah_Greater_Sydney_New_South_Wales.html
HGB1970,Great beach,"North Narbeen Beach This is one of the traditional beaches of Australia. BE WARNED, Rips are frequent on this beach so be careful and always, always swim between the flags",4,https://www.tripadvisor.com/ShowUserReviews-g2034319-d589953-r453166997-North_Narrabeen_Beach-Narrabeen_Warringah_Greater_Sydney_New_South_Wales.html
mgsnorwich,A beach for everybody,"North Narbeen Beach The beach is beautiful and ideal for surfing and to the north the small, tidal creek is an ideal, safe area for children to play. It is the connection between the Narrabeen Lakes and the ocean and at low tide the water flows seawards leaving little islands which at high tide are covered in water.
Also to the north there are two tidal swimming pools, both of them quite shallow but ideal for safe swimming. There are also showers and public toilets. There is also a walkway, up stairs on the Coastal path from which there are great views down the coast to Long Reef.",4,https://www.tripadvisor.com/ShowUserReviews-g2034319-d589953-r447053033-North_Narrabeen_Beach-Narrabeen_Warringah_Greater_Sydney_New_South_Wales.html
TomW423,Legendary surfing beach,"North Narbeen Beach Location of the best and most consistent surfing beaches in Sydney if not nsw, given a mention in Beach Boys classic Surfin USA . Patrolled beach , parking a problem on sunny days , ok for kids with an adult",5,https://www.tripadvisor.com/ShowUserReviews-g2034319-d589953-r445775192-North_Narrabeen_Beach-Narrabeen_Warringah_Greater_Sydney_New_South_Wales.html
559kathrynl,Great beach for surfing or swimming,"North Narbeen Beach Known locally as an excellent surfing beach, North Narrabeen beach is also a great place for families as the beach is patrolled and there is a large ocean swimming pool with dedicated swimmers lanes as well as a pool ranging from shallow to deeper to suit all ages and abilities. The are also toilets, showers and a cafe to hand. Parking is limited but there is street parking in the area.  Feel like some exercise? You can walk up Narrabeen Headland to Turimetta, Warriewood or Mona Vale Headlands - all the way up the coast to Palm Beach for the serious trekkers. Great for an hour or spend the day",5,https://www.tripadvisor.com/ShowUserReviews-g2034319-d589953-r438003585-North_Narrabeen_Beach-Narrabeen_Warringah_Greater_Sydney_New_South_Wales.html
R2810NLsusanp,Lovely beach,"North Narbeen Beach Visited here on saturday 12th November. It was a bit rough due to the surf but lovely beach, also near lagoon where we were and also had ocean baths. Beautiful.",4,https://www.tripadvisor.com/ShowUserReviews-g2034319-d589953-r436746970-North_Narrabeen_Beach-Narrabeen_Warringah_Greater_Sydney_New_South_Wales.html
694BenM,Fantastic Location,"North Narbeen Beach Beautiful beach, very quiet with cracking waves for surfing.  So good it was mentioned in the Beach Boys Surfin' USA song.  There's a great swimming pool at the end of the beach near to the brilliant surf club.  The Hit Cafe inside serves tremendous food.  Don't bother going anywhere else.  It's tremendous value for money and the quality is great.  The staff are very polite and helpful.  It really added to our time at the beach.  The kids loved their time on the beach and the surf club, happy kids means happy parents!",5,https://www.tripadvisor.com/ShowUserReviews-g2034319-d589953-r406870836-North_Narrabeen_Beach-Narrabeen_Warringah_Greater_Sydney_New_South_Wales.html
JeanetteV175,""" relaxing day out at the beach""",North Narbeen Beach North Narrabeen is our most favourite place to visit. We have been going there for many years with our children as they were growing up and now they visit with their families. Narrabeen is such a relaxing place for the whole family with lots to do. The rock pool is quite popular but I really enjoy a walk along the uncrowded beach.,5,https://www.tripadvisor.com/ShowUserReviews-g2034319-d589953-r383013294-North_Narrabeen_Beach-Narrabeen_Warringah_Greater_Sydney_New_South_Wales.html
SueMarkus,Just gorgeous,"North Narbeen Beach Where else can you walk along a beach and be able to enjoy a good degree of solitude and only half an hour from the centre of Sydney.  During the week from North Narrabeen to Collaroy I'm lucky to bump into a couple of people - on the weekends in warmer weather it can be a different story.  At the North Narrabeen end, there's two rock pools, the lagoon and the surf to choose from for a swim.  If you feel more energetic you can walk up the stairs then through the bush to Turrimetta Beach or if you feel lazy and hungry, there's a café on the surf club roof with great coffee and by the looks of it - pretty good food!",5,https://www.tripadvisor.com/ShowUserReviews-g2034319-d589953-r375677662-North_Narrabeen_Beach-Narrabeen_Warringah_Greater_Sydney_New_South_Wales.html
johnkB3164AW,great uncrowded beach,"North Narbeen Beach North Narrabeen Beach is great for surfers and anybody just looking for an uncrowded beach to lounge on or swim in,theres a great sea pool to swim in at the northern end of the beach and a beach club and facilities near by.  The lake entrance is a good place for kids to spash around in a safely.",4,https://www.tripadvisor.com/ShowUserReviews-g2034319-d589953-r375319389-North_Narrabeen_Beach-Narrabeen_Warringah_Greater_Sydney_New_South_Wales.html
lindadownunder,Another beautiful northern beach,"North Narbeen Beach North Narrabeen Beach is another example of a beautiful Sydney northern beach.
Plenty to do, simply walk the beach, surf or enjoy the rock pool.",4,https://www.tripadvisor.com/ShowUserReviews-g2034319-d589953-r372505269-North_Narrabeen_Beach-Narrabeen_Warringah_Greater_Sydney_New_South_Wales.html
885margaretc,Great clubhouse,"North Narbeen Beach Great family beach, the clubhouse Friday night is good fun as well. The lake empties into the sea at the northern end and means good fishing and great wave catching for kids when tide running in, totally safe.",4,https://www.tripadvisor.com/ShowUserReviews-g2034319-d589953-r369802741-North_Narrabeen_Beach-Narrabeen_Warringah_Greater_Sydney_New_South_Wales.html
Swanniejenn,Morning walk,"North Narbeen Beach Great walk from the nearby caravan park. There are two swimming pools, that are used a lot by the locals. God walk alone the beach, and watch the surfers.",5,https://www.tripadvisor.com/ShowUserReviews-g2034319-d589953-r365844018-North_Narrabeen_Beach-Narrabeen_Warringah_Greater_Sydney_New_South_Wales.html
Albywon,At the end of the Lagoon,North Narbeen Beach Another of the beautiful Northern Beaches. This beach is bounded on the north by the headland and also the inlet of the Narrabeen lakes. From there it stretches south down towards Colloroy.,4,https://www.tripadvisor.com/ShowUserReviews-g2034319-d589953-r361840152-North_Narrabeen_Beach-Narrabeen_Warringah_Greater_Sydney_New_South_Wales.html
sarahsergz,Loved this beach,"North Narbeen Beach Sydney, your beaches rock! This was such beautiful place to swim and body surf. It was great when the tide went out for the kids but beware of the rips and currents if you are not swimming in the flags. The ocean pools are so lovely and the rock pools around it kept the kids entertained for hours.",5,https://www.tripadvisor.com/ShowUserReviews-g2034319-d589953-r357161188-North_Narrabeen_Beach-Narrabeen_Warringah_Greater_Sydney_New_South_Wales.html
jfp1997,Great Walk,"North Narbeen Beach I walked from the Sands Hotel to North Narrabeen, great exercise regime. Such a beautiful location, quiet and relaxing.
make sure your have your bathers. hat, water and sunscreen.
Great for walkers of any experience.",5,https://www.tripadvisor.com/ShowUserReviews-g2034319-d589953-r350101598-North_Narrabeen_Beach-Narrabeen_Warringah_Greater_Sydney_New_South_Wales.html
S447TSryanc,love,North Narbeen Beach Narrabeen beach is really nice for swimming and surfing and its just a generally lovely place I love it,5,https://www.tripadvisor.com/ShowUserReviews-g2034319-d589953-r348339528-North_Narrabeen_Beach-Narrabeen_Warringah_Greater_Sydney_New_South_Wales.html
darren_niwa,The beach is amazing and so clean and relaxing.,North Narbeen Beach We have been to quite a few beaches in the world and this one is one of the nicest. It was groomed and clean and not crowded at all. Simply beautiful.,4,https://www.tripadvisor.com/ShowUserReviews-g2034319-d589953-r344749976-North_Narrabeen_Beach-Narrabeen_Warringah_Greater_Sydney_New_South_Wales.html
