user,title,text,rating,url
22biancam,Beautiful beach,"Stunning, beautiful clean beach. Awesome location, great for swimming and bodyboarding. Patrolled and flags.",5,https://www.tripadvisor.com/ShowUserReviews-g255335-d2334163-r639634475-Coolangatta_Beach-Coolangatta_Gold_Coast_Queensland.html
U5549HWsandrac,Beautiful,"Beautiful Beach great surf. Great restaurants, cafes and Bars. Timezone in the main street for kids as well as a skate park around the corner.",5,https://www.tripadvisor.com/ShowUserReviews-g255335-d2334163-r639337608-Coolangatta_Beach-Coolangatta_Gold_Coast_Queensland.html
731wayneh,Excellent on Market Days,Attend this beach when they have the Sunday markets as the beach is vibrant with lots of stalls and food outlets.,4,https://www.tripadvisor.com/ShowUserReviews-g255335-d2334163-r638914421-Coolangatta_Beach-Coolangatta_Gold_Coast_Queensland.html
Pamikki,usual gold coast paradise,"lots to see, do, hear and to just sit back and enjoy what is on offer.  can be a busy place at certain times of the year",4,https://www.tripadvisor.com/ShowUserReviews-g255335-d2334163-r636435985-Coolangatta_Beach-Coolangatta_Gold_Coast_Queensland.html
tonysyd274,Amazing end to the day,Quick overnight trip in Coolangatta that gave me the opportunity to walk the beach at sunset and end the day perfectly!,5,https://www.tripadvisor.com/ShowUserReviews-g255335-d2334163-r636283491-Coolangatta_Beach-Coolangatta_Gold_Coast_Queensland.html
LynC475,A Day at the Beach,A family get together at Rainbow Bay beach.  A beautiful sunny day and old faces that we had not seen for ages.  We had our own gazebo and entertained ourselves but the picturesque background really made it a great family reunion.,5,https://www.tripadvisor.com/ShowUserReviews-g255335-d2334163-r634533718-Coolangatta_Beach-Coolangatta_Gold_Coast_Queensland.html
rosiees7,Beautiful but packed!,"This is not the place to go if you want to avoid the crowds. It is the place to go, however, if you want to have a surfing lesson, play in the sea, or just chill on the sand. Some lovely afternoons spent here, but choose somewhere else if you want peace and quiet.",4,https://www.tripadvisor.com/ShowUserReviews-g255335-d2334163-r633961327-Coolangatta_Beach-Coolangatta_Gold_Coast_Queensland.html
Emmamagill,Gorgeous,A great part of the QLD coastline and Australia. Quieter than nearby Surfers Paradise with a variety of restaurants and retail.,5,https://www.tripadvisor.com/ShowUserReviews-g255335-d2334163-r633927464-Coolangatta_Beach-Coolangatta_Gold_Coast_Queensland.html
jamesmB5171WK,Coolangatta beach,A lovely clean beach with golden sand & awesome surf. Lifesavers have flags to swim between for safety. There are volleyball nets there.,5,https://www.tripadvisor.com/ShowUserReviews-g255335-d2334163-r632943238-Coolangatta_Beach-Coolangatta_Gold_Coast_Queensland.html
lilacs1,Great picturesque venue,"Fabulous Coolangatta, it has everything you need, beaches, picnic areas, kids playground, clean amenities, barbecues, lot's of different restaraunts, cafes and eateries, Movies, grocery shopping, Fashion , shoes, jewellery, beauty etc etc!!",5,https://www.tripadvisor.com/ShowUserReviews-g255335-d2334163-r632063462-Coolangatta_Beach-Coolangatta_Gold_Coast_Queensland.html
Cruiser254967,Relaxing Beach,This beach has a local Surf Club that serve delicious food with different variety everyday. Nice place to catch up with friends and hang out with family!,5,https://www.tripadvisor.com/ShowUserReviews-g255335-d2334163-r630838466-Coolangatta_Beach-Coolangatta_Gold_Coast_Queensland.html
Girltrav,"When in Cooly, go to the Cooly","Every visit to the coast I arrange to catch up with friends at the Cooly Hotel.  Staff are really friendly and prices are comparable with other establishments in the area.  Friday and Saturday nights can be pretty noisy, understandably so at least the music was good.  See you next time :)",3,https://www.tripadvisor.com/ShowUserReviews-g255335-d2334163-r630190407-Coolangatta_Beach-Coolangatta_Gold_Coast_Queensland.html
JaneSK6,"sea, sun and surf and a good coffee","Visited here many times during our holiday.  Much nicer than the built up Surfers Paradise.   Clean sandy beach, changing facilities, outdoor shower and nice coffee shop nearby.",5,https://www.tripadvisor.com/ShowUserReviews-g255335-d2334163-r630039347-Coolangatta_Beach-Coolangatta_Gold_Coast_Queensland.html
elainem678,Beautiful beach location and shops cafes and restaurants so close by,Cooly beach as the locals call it has something for everyone- but limited beach front parking - with a thriving shopping area cross the road. Lots of accommodation and for night life the Cooly Hotel is close. If you want the Gold Coast experience but don’t want the over commercialised Surfers Paradise tourist feel this is the place . Suitable for families with all aged children,5,https://www.tripadvisor.com/ShowUserReviews-g255335-d2334163-r629422636-Coolangatta_Beach-Coolangatta_Gold_Coast_Queensland.html
jamiefI9061PH,Enjoy shopping Then a swim,Coolangatta beach is opposite the shops so you have the best of both worlds.  A great day of sand & surf with a walk across the road for lunch or snack.  And if you have forgotten something plenty of shops to purchase from.  And the best part heaps of parking along with toilets ( modern / new ) and showers to rinse off.,5,https://www.tripadvisor.com/ShowUserReviews-g255335-d2334163-r628965118-Coolangatta_Beach-Coolangatta_Gold_Coast_Queensland.html
marijab46,"Coolangatta Beach has beautiful views, and it is very calming.","long lovely walks along the beach.  Anytime, mornings, afternoon and especially evenings.  it is beautiful.",4,https://www.tripadvisor.com/ShowUserReviews-g255335-d2334163-r628255797-Coolangatta_Beach-Coolangatta_Gold_Coast_Queensland.html
tcuskely,Lovely Beach,"Coolangatta is Just your typical wonderful, beautiful and gorgeous sand beach on the Gold Coast ., simply superb",5,https://www.tripadvisor.com/ShowUserReviews-g255335-d2334163-r628175267-Coolangatta_Beach-Coolangatta_Gold_Coast_Queensland.html
BillyK1980,Lovely,The beach at Cooli is really nice and not as busy as other golf coast beaches. Lovely place to unwind,4,https://www.tripadvisor.com/ShowUserReviews-g255335-d2334163-r627125090-Coolangatta_Beach-Coolangatta_Gold_Coast_Queensland.html
